title;volume;age is used ;age sentence;sex/gender is used ;sex/gender sentence;etnicity is used;etnicity sentence
SLPD: Slide-Level Prototypical Distillation for WSIs;1;0;;0;;0;
SLPT: Selective Labeling Meets Prompt Tuning on Label-Limited Lesion Segmentation;2;0;;0;;0;
Solving Low-Dose CT Reconstruction via GAN with Local Coherence;10;0;;0;;0;
Spectral Adversarial MixUp for Few-Shot Unsupervised Domain Adaptation;1;0;;0;;0;
StainDiff: Transfer Stain Styles of Histology Images with Denoising Diffusion Probabilistic Models and Self-ensemble;6;0;;0;;0;
Structure-Preserving Instance Segmentation via Skeleton-Aware Distance Transform;3;0;;0;;0;
Structure-Preserving Synthesis: MaskGAN for Unpaired MR-CT Translation;10;1;we targeted the age group from 6-24 months since pediatric patients are more susceptible to ionizing radiation and experience a greater cancer risk (up to 24% increase) from radiation exposure [7].;0;;0;
Structured State Space Models for Multiple Instance Learning in Digital Pathology;1;0;;0;;0;
StructuRegNet: Structure-Guided Multimodal 2D-3D Registration;10;0;;0;;0;
Surgical Video Captioning with Mutual-Modal Concept Alignment;9;0;;0;;0;
SwinUNETR-V2: Stronger Swin Transformers with Stagewise Convolutions for 3D Medical Image Segmentation;4;0;;0;;0;
Synthesis of Contrast-Enhanced Breast MRI Using T1- and Multi-b-Value DWI-Based Hierarchical Fusion Network with Attention Mechanism;7;0;;0;;0;
Synthetic Augmentation with Large-Scale Unconditional Pre-training;2;0;;0;;0;
Text-Guided Cross-Position Attention for Segmentation: Case of Medical Image;5;0;;0;;0;
Text-Guided Foundation Model Adaptation for Pathological Image Classification;5;0;;0;;0;
Thinking Like Sonographers: A Deep CNN Model for Diagnosing Gout from Musculoskeletal Ultrasound;6;0;;0;;0;
Thyroid Nodule Diagnosis in Dynamic Contrast-Enhanced Ultrasound via Microvessel Infiltration Awareness;6;0;;0;;0;
Topology-Preserving Computed Tomography Super-Resolution Based on Dual-Stream Diffusion Model;10;0;;0;;0;
Towards AI-Driven Radiology Education: A Self-supervised Segmentation-Based Framework for High-Precision Medical Image Editing;2;0;;0;;0;
Towards Multi-modal Anatomical Landmark Detection for Ultrasound-Guided Brain Tumor Resection with Contrastive Learning;9;0;;0;;0;
Towards Novel Class Discovery: A Study in Novel Skin Lesions Clustering;6;0;;0;;0;
TPRO: Text-Prompting-Based Weakly Supervised Histopathology Tissue Segmentation;1;0;;0;;0;
Trackerless Volume Reconstruction from Intraoperative Ultrasound Images;10;0;;0;;0;
Tracking Adaptation to Improve SuperPoint for 3D Reconstruction in Endoscopy;1;0;;0;;0;
TractCloud: Registration-Free Tractography Parcellation with a Novel Local-Global Streamline Point Cloud Representation;8;0;;0;;0;
Transfer Learning-Assisted Survival Analysis of Breast Cancer Relying on the Spatial Interaction Between Tumor-Infiltrating Lymphocytes and Tumors;6;0;;0;;0;
TransLiver: A Hybrid Transformer Model for Multi-phase Liver Lesion Classification;2;0;;0;;0;
TransNuSeg: A Lightweight Multi-task Transformer for Nuclei Segmentation;4;0;;0;;0;
Triangular Analysis of Geographical Interplay of Lymphocytes (TriAnGIL): Predicting Immunotherapy Response in Lung Cancer;6;0;;0;;0;
Uncertainty-Informed Mutual Learning for Joint Medical Image Classification and Segmentation;4;0;;0;;0;
Understanding Silent Failures in Medical Image Classification;3;0;;0;;0;
Unified Brain MR-Ultrasound Synthesis Using Multi-modal Hierarchical Representations;10;0;;1;"we evaluated our method on a dataset of 66
consecutive adult patients with brain gliomas who were surgically treated at the
brigham and women's hospital,";0;
UniSeg: A Prompt-Driven Universal Segmentation Model as Well as A Strong Representation Learner;3;0;;0;;0;
Unpaired Cross-Modal Interaction Learning for COVID-19 Segmentation on Limited CT Images;3;0;;0;;0;
Unsupervised Discovery of 3D Hierarchical Structure with Generative Diffusion Features;1;0;;0;;0;
VesselVAE: Recursive Variational Autoencoders for 3D Blood Vessel Synthesis;1;0;;0;;0;
VISA-FSS: A Volume-Informed Self Supervised Approach for Few-Shot 3D Segmentation;2;0;;0;;0;
vox2vec: A Framework for Self-supervised Contrastive Learning of Voxel-Level Representations in Medical Images;1;0;;0;;0;
Weakly-Supervised Positional Contrastive Learning: Application to Cirrhosis Classification;1;0;;0;;0;
WeakPolyp: You only Look Bounding Box for Polyp Segmentation;3;0;;0;;0;
What Do AEs Learn? Challenging Common Assumptions in Unsupervised Anomaly Detection;5;0;;0;;0;
X2Vision: 3D CT Reconstruction from Biplanar X-Rays with Deep Structure Prior;10;0;;0;;0;
YONA: You Only Need One Adjacent Reference-Frame for Accurate and Fast Video Polyp Detection;5;0;;0;;0;