,title,header_no,header_title,text,volume
1119,Graph-Theoretic Automatic Lesion Tracking and Detection of Patterns of Lesion Changes in Longitudinal CT Studies,3.0,Experimental Results,"we evaluated our method with two studies on retrospectively collected patient
datasets that were manually annotated by an expert radiologist.dataset: lung and
liver ct studies were retrospectively obtained from two medical centers
(hadassah univ hosp jerusalem israel) during the routine clinical examination of
patients with metastatic disease. each patient study consists of at least 3
scans.dlung consists of 83 chest ct scans from 19 patients with a mean 4.4 ± 2.0
scans/patient, a mean time interval between consecutive scans of 125.9 ± 81.3
days, and voxel sizes of 0.6-1.0 × 0.6-1.0 × 1.0-3.0 mm 3 . dliver consists of
77 abdominal cect scans from 18 patients with a mean 4.3 ± 2.0 scans/patient, a
mean time interval between consecutive scans of 109.7 ± 93.5 days, and voxel
sizes of 0.6-1.0 × 0.6-1.0 × 0.8-5.0 mm 3 .lesions in both datasets were
annotated by an expert radiologist, yielding a total of 1,178 lung and 800 liver
lesions, with a mean of 14.2 ± 19.1 and 10.4 ± 7.9 lesions/scan (lesions with
<20 voxels were excluded). ground-truth lesion matching graphs and lesion
changes labeling were produced by running the method on the datasets and then
having the radiologist review and correct the resulting node labels and
edges.study 1: lesion changes labeling, lesion matching, evaluation of patterns
of lesion changes. we ran our method on the dlungs and dliver lesion
segmentations. the settings of the parameters were: dilation distance d = 1 mm,
overlap percentage p = 10%, number of iterations r = 5 and 7, and centroid
maximum distance δ = 17 and 23 mm for the lungs and liver lesions,
respectively.we compared the computed and ground-truth lesion changes graphs
with two metrics: 1) lesion changes classification accuracy, which is the % of
correct computed labels from the ground truth labels; 2) lesion matching
precision and recall based on the presence/absence of computed vs. ground truth
edges. the precision and recall definitions were adapted so that wrong or missed
non-consecutive edges are counted as true positive when there is a path between
their vertices in either the ground-truth or the computed graph. table 1
summarizes the results. the distribution of lesion changes labels for dlungs
(1,178 lesions) is unique 785 (67%), new 215 (18%), lone 109 (9%), disappeared
51 (4%), merged 12 (1%), split 6 (1%), complex 0 (0%) with class accuracy ≥ 96%
for all except split (66%). for dliver (800 lesions) it is unique 450 (56%), new
185 (23%), lone 45 (6%), disappeared 77 (10%), merged 27 (3%), split 18 (2%),
complex 1 (0.05%) with class accuracy ≥ 81% for all except disappeared (71%) and
split (67%).for the patterns of lesion changes, we compared the computed and
ground truth patterns of lesion changes. the accuracy is the % of identical
connected components in each category. table 1 summarizes the results. note that
the split_p, merged_p and complex_p patterns jointly account for 3% and 8% of
the cases. these patterns are hard to detect manually but their correct
classification and tracking are crucial for the proper application of the recist
1.1 follow-up protocol [1]. study 2: detection of missed lesions in the ground
truth. the expert radiologist was asked to examine non-consecutive edges and
lesions labeled as lone in the lesion changes graph and determine if lesions
were unseen or undetected (actual or presumed false negative) in the skipped or
contiguous scans (fig. 1d). for each non-consecutive edge connecting lesions v i
j , v k l , he analyzed the corresponding region in the skipped scans s j at t j
∈ ]t i , t k [ for possible missed lesions. for the dlungs dataset, 25 visible
and 5 faintly visible or surmised to be present unmarked lesions were found for
27 nonconsecutive edges. for the dliver dataset, 20 visible and 21 faintly
visible or surmised to be present unmarked lesions were found for 25
non-consecutive edges.after reviewing the 42 and 37 lesions labeled as lone in
dlungs and dliver with > 5mm diameter, the radiologist determined that 1 and 8
of them had been wrongly identified as a cancerous lesion. moreover, he found
that 14 and 16 lesions initially labeled as lone, had been wrongly classified:
for these lesions he found 15 and 21 previously unmarked matching lesions in the
next or previous scans. in total, 45 and 62 missing lesions were added to the
ground truth dlungs and dliver datasets, respectively. these hard-to-find
ground-truth false negatives (3.7%, 7.2% of all lesions) may change the
radiological interpretation and the disease status. see the supplemental
material for examples of these scenarios.",5
1120,Graph-Theoretic Automatic Lesion Tracking and Detection of Patterns of Lesion Changes in Longitudinal CT Studies,4.0,Conclusion,"the use of graph-based methods for lesion tracking and detection of patterns of
lesion changes was shown to achieve high accuracy in classifying changes in
individual lesion and identifying patterns of lesion changes in liver and lung
longitudinal ct studies of patients with metastatic disease. this approach has
proven to be useful in detecting missed, faint, and surmised to be present
lesions, otherwise hardly detectable by examining the scans separately or in
pairs, leveraging the added information provided by evaluating all patient's
scans simultaneously using the labels from the lesion changes graph and
non-consecutive edges.",5
1122,Robust Exclusive Adaptive Sparse Feature Selection for Biomarker Discovery and Early Diagnosis of Neuropsychiatric Systemic Lupus Erythematosus,1.0,Introduction,"neuropsychiatric systemic lupus erythematosus (npsle) refers to a complex
autoimmune disease that damages the brain nervous system of patients. the
clinical symptoms of npsle include cognitive disorder, epilepsy, mental illness,
etc., and patients with npsle have a nine-fold increased mortality compared to
the general population [11]. since the pathogenesis and mature treatment of
npsle have not yet been found, it is extremely important to detect npsle at its
early stage and put better clinical interventions and treatments to prevent its
progression. however, the high overlap of clinical symptoms with other
psychiatric disorders and the absence of early non-invasive biomarkers make
accurate diagnosis difficult and time-consuming [3].although conventional
magnetic resonance imaging (mri) tools are widely used to detect brain injuries
and neuronal lesions, around 50% of patients with npsle present no brain
abnormalities in structural mri [17]. in fact, metabolic changes in many brain
diseases precede pathomorphological changes, which indicates proton magnetic
resonance spectroscopy ( 1 h-mrs) to be a more effective way to reflect the
early appearance of npsle. 1 h-mrs is a non-invasive neuroimaging technology
that can quantitatively analyze the concentration of metabolites and detect
abnormal metabolism of the nervous system to reveal brain lesions. however, the
complex noise caused by overlapping metabolite peaks, incomplete information on
background components, and low signal-tonoise ratio (snr) disturb the analysis
results of this spectroscopic method [15]. meanwhile, the individual differences
in metabolism and the interaction between metabolites under low sample size make
it difficult for traditional learning methods to distinguish npsle. figure 1
shows spectra images of four participants including healthy controls (hc) and
patients with npsle. it can be seen that the visual differences between patients
with npsle and hcs in the spectra of the volumes are subtle. therefore, it is
crucial to develop effective learning algorithms to discover metabolic
biomarkers and accurately diagnose npsle. the machine learning application for
biomarker analysis and early diagnosis of npsle is at a nascent stage [4]. most
studies focus on the analysis of mr images using statistical or machine learning
algorithms, such as mann-whitney u test [8], support vector machine (svm)
[7,24], ensemble model [16,22], etc. generally, machine learning algorithms
based on the minimum mean square error (mmse) criterion heavily rely on the
assumption that noise is of gaussian distribution. however, measurement-induced
non-gaussian noise in 1 h-mrs data undoubtedly limits the performance of
mmse-based machine learning methods.on the other hand, for the discovery task of
potential biomarkers, sparse codingbased methods (e.g., 2,1 norm, 2,0 norm,
etc.) force row elements to zero that remove some valuable features [12,21].
more importantly, different brain regions have different functions and
metabolite concentrations, which implies that the metabolic features for each
brain region have different sparsity levels. therefore, applying the same
sparsity constraint to the metabolic features of all brain regions may not
contribute to the improvement of the diagnostic performance of npsle.in light of
this, we propose a robust exclusive adaptive sparse feature selection (reasfs)
algorithm to jointly address the aforementioned problems in biomarker discovery
and early diagnosis of npsle. specifically, we first extend our feature learning
through generalized correntropic loss to handle data with complex non-gaussian
noise and outliers. we also present the mathematical analysis of the adaptive
weighting mechanism of generalized correntropy. then, we propose a novel
regularization called generalized correntropy-induced exclusive 2,1 to
adaptively accommodate various sparsity levels and preserve informative
features. the experimental results on a benchmark npsle dataset demonstrate the
proposed method outperforms comparing methods in terms of early noninvasive
biomarker discovery and early diagnosis.",5
1123,Robust Exclusive Adaptive Sparse Feature Selection for Biomarker Discovery and Early Diagnosis of Neuropsychiatric Systemic Lupus Erythematosus,2.0,Method,"dataset and preprocessing: the t2-weighted mr images of 39 participants
including 23 patients with npsle and 16 hcs were gathered from our affiliated
hospital. all images were acquired at an average age of 30.6 years on a signa
3.0t scanner with an eight-channel standard head coil. then, the mr images were
transformed into spectroscopy by multi-voxel 1 h-mrs based on a point-resolved
spectral sequence (press) with a two-dimensional multi-voxel technique. the
collected spectroscopy data were preprocessed by a sage software package to
correct the phase and frequency. an lcmodel software was used to fit the
spectra, correct the baseline, relaxation, and partial-volume effects, and
quantify the concentration of metabolites. finally, we used the absolute naa
concentration in single-voxel mrs as the standard to gain the absolute
concentration of metabolites, and the naa concentration of the corresponding
voxel of multi-voxel 1 h-mrs was collected consistently. the spectra would be
accepted if the snr is greater than or equal to 10 and the metabolite
concentration with standard deviations (sd) is less than or equal to 20%. the
absolute metabolic concentrations, the corresponding ratio, and the linear
combination of the spectra were extracted from different brain regions: rpcg,
lpcg, rdt, ldt, rln, lln, ri, rpwm, and lpwm. a total of 117 metabolic features
were extracted, and each brain region contained 13 metabolic features: cr,
phosphocreatine (pcr), cr+pcr, naa, naag, naa+naag, naa+naag/cr+pcr, mi,
mi/cr+pcr, cho+phosphocholine (pch), cho+pch/cr+pcr, glu+gln, and
glu+gln/cr+pcr.",5
1127,Robust Exclusive Adaptive Sparse Feature Selection for Biomarker Discovery and Early Diagnosis of Neuropsychiatric Systemic Lupus Erythematosus,3.0,Experimental Results and Conclusion,"experimental settings: the parameters α and λ 1 are are set to 1, while β and λ
2 are searched form {0.5, 1, 2, 5} and {0.1, 0.5, 1}, respectively. we use adam
optimizer and the learning rate is 0.001. to evaluate the performance of
classification, we employ a support vector machine as the basic classifier,
where the kernel is set as the radial basis function (rbf) and parameter c is
set to 1. we average the 3-fold cross-validation results.results and discussion:
we compare the classification accuracy of the proposed reasfs with several sota
baselines, including two filter methods: maximal information coefficient (mic)
[5], gini [23], and four sparse coding-based methods: multi-task feature
learning via 2,1 norm [6,12], discriminative feature selection via 2,0 norm
[21], feature selection via 1,2 norm [10] and exclusive 2,1 [9]. the proposed
reasfs is expected to have better robustness and flexibility. it can be seen
from fig. 2 that the sparse coding-based methods achieve better performance than
filter methods under most conditions, where ""0%"" represents no noise
contamination. the highest accuracy of our reasfs demonstrates the effectiveness
and flexibility of the proposed gcie 2,1 . generally speaking, the probability
of samples being contaminated by random noise is equal. therefore, we randomly
select features from the training set and replace the selected features with
pulse noise. the number of noisy attributes is denoted by the ratio between the
numbers of selected features and total features, such as 15% and 30%. the
classification performances of the npsle dataset contaminated by attribute noise
are shown in fig. 3(a) and fig. 3(b), where one clearly perceives that our
reasfs achieves the highest accuracy under all conditions. besides, it is
unreasonable to apply the same level of sparse regularization to noise features
and uncontaminated features, and our gcie 2,1 can adaptively increase the sparse
level of noise features to remove redundant information, and vice versa. for
label noise, we randomly select samples from the training set and replace
classification labels of the selected samples with opposite values, i.e., 0 → 1
and 1 → 0. the results are shown in fig. 3(c) and fig. 3(d), where the proposed
reasfs is superior to other baselines. it can be seen from fig. 3 that our
reasfs achieves the highest accuracy in different noisy environments, which
demonstrates the robustness of generalized correntropic loss. for non-invasive
biomarkers, our method shows that some metabolic features contribute greatly to
the early diagnosis of npsle, i.e., naag, mi/cr+pcr, and glu+gln/cr+pcr in rpcg;
cr+pcr, naa+naag, naa+naag/cr+pcr, mi/cr+pcr and glu+gln in lpcg; naa, naag, and
cho+pch in ldt; pcr, cr+pcr, cho+pch, cho+pch/cr+pcr and glu+gln/cr+pcr in rln;
mi/cr+pcr, cho+pch and cho+pch/cr+pcr in lln; naa+naag/cr+pcr and cho+pch in ri;
cho+pch/cr+pcr and glu+gln/cr+pcr in rpwm; and pcr, naag and naa+naag/cr+pcr in
lpwm. moreover, we use isometric feature mapping (isomap) [19] to analyze these
metabolic features and find that this feature subset is essentially a
low-dimensional manifold. meanwhile, by combining the proposed reasfs and
isomap, we can achieve 99% accuracy in the early diagnosis of npsle. in
metabolite analysis, some studies have shown that the decrease in naa
concentration is related to chronic inflammation, damage, and tumors in the
brain [18]. in the normal white matter area, different degrees of npsle disease
is accompanied by different degrees of naa decline, but structural mri is not
abnormal, suggesting that naa may indicate the progress of npsle. we also found
that glu+gln/cr+pcr in ri decreased, which indicates that the excitatory
neurotransmitter glu in the brain of patients with npsle may have lower
activity. to sum up, the proposed method provides a shortcut for revealing the
pathological mechanism of npsle and early detection.",5
1135,CARL: Cross-Aligned Representation Learning for Multi-view Lung Cancer Histology Classification,3.1,Dataset,"our dataset nsclc-tcia for lung cancer histological subtype classification is
sourced from two online resources of the cancer imaging archive (tcia) [5]:
nsclc radiomics [1] and nsclc radiogenomics [2]. exclusion criteria involves
patients diagnosed with large cell carcinoma or not otherwise specified, along
with cases that have contouring inaccuracies or lacked tumor delineation [9,13].
finally, a total of 325 available cases (146 adc cases and 179 scc cases) are
used for our study. we evaluate the performance of nsclc classification in
five-fold cross validation on the nsclc-tcia dataset, and measure accuracy
(acc), sensitivity (sen), specificity (spe), and the area under the receiver
operating characteristic (roc) curve (auc) as evaluation metrics. we also
conduct analysis including standard deviations and 95% ci, and delong
statistical test for further auc comparison.for preprocessing, given that the ct
data from nsclc-tcia has an in-plane resolution of 1 mm × 1 mm and a slice
thickness of 0.7-3.0 mm, we resample the ct images using trilinear interpolation
to a common resolution of 1mm × 1mm × 1mm. then one 128 × 128 pixel slice is
cropped from each view as input based on the center of the tumor. finally
following [7], we clip the intensities of the input patches to the interval
(-1000, 400 hounsfield unit) and normalize them to the range of [0, 1].",5
1138,CARL: Cross-Aligned Representation Learning for Multi-view Lung Cancer Histology Classification,4.0,Conclusion,"in summary, we propose a novel multi-view method called cross-aligned
representation learning (carl) for accurately distinguishing between adc and scc
using multi-view ct images of nsclc patients. it is designed with a cross-view
representation alignment learning network which effectively generates
discriminative view-invariant representations in the common subspace to reduce
the discrepancies among multi-view images. in addition, we leverage a
view-specific representation learning network to acquire viewspecific
representations as a necessary complement. the generated view-invariant and
-specific representations together offer a holistic and disentangled perspective
of the multi-view ct images for histological subtype classification of nsclc.
the experimental result on nsclc-tcia demonstrates that carl reaches 0.817 auc,
76.8% acc, 73.2% sen, and 79.7% spe and surpasses other relative approaches,
confirming the effectiveness of the proposed carl method.",5
1139,Self- and Semi-supervised Learning for Gastroscopic Lesion Detection,1.0,Introduction,"gastroscopic lesion detection (gld) plays a key role in computer-assisted
diagnostic procedures. although deep neural network-based object detectors
achieve tremendous success within the domain of natural images, directly
training generic object detectors on gld datasets performs below expectations
for two reasons: 1) the scale of labeled data in gld datasets is limited in
comparison to natural images due to the annotation costs. though gastroscopic
images are abundant, those containing lesions are rare, which necessitates
extensive image review for lesion annotation. 2) the characteristic of
gastroscopic images exhibits distinct differences from the natural images
[18,19,21] and is often of high similarity in global but high diversity in
local. specifically, each type of lesion may have diverse appearances though
gastroscopic images look quite similar. some appearances of lesions are quite
rare and can only be observed in a few patients. generic self-supervised
backbone pre-training or semi-supervised detector training methods can solve the
first challenge for natural images but its effectiveness is undermined for
gastroscopic images due to the second challenge.self-supervised backbone
pre-training methods enhance object detection performance by learning
high-quality feature representations from massive unlabelled data for the
backbone. the mainstream self-supervised backbone pretraining methods adopt
self-supervised contrast learning [3,4,7,9,10] or masked fig. 1. pipeline of
self-and semi-supervised learning (ssl) for gld. ssl consists of a hybrid
self-supervised learning (hsl) method and a prototype-based pseudo-label
generation (ppg) method. hsl combines patch reconstruction with dense
contrastive learning. ppg generates pseudo-labels for potential lesions based on
the similarity to the prototype feature vectors.image modeling [8,15].
self-supervised contrastive learning methods [3,4,7,9] can learn discriminative
global feature representations, and [10] can further learn discriminative local
feature representations by extending contrastive learning to dense paradigm.
however, these methods usually cannot grasp enough local detailed information.
on the other hand, masked image modeling is expert in extracting local detailed
information but is weak in preserving the discriminability of feature
representation. therefore, both types of methods have their own weakness for gld
tasks.semi-supervised object detection methods [12,14,16,17,20,22,23] first use
detectors trained with labeled data to generate pseudo-labels for unlabeled data
and then enhance object detection performance by regarding these unlabeled data
with pseudo-labels as labeled data to train the detector. current pseudolabel
generation methods rely on the objectiveness score threshold to generate
pseudo-labels, which makes them perform below expectations on gld, because the
characteristic of gastroscopic lesions makes it difficult to set a suitable
threshold to discover potential lesions meanwhile avoiding introducing much
noise.the motivation of this paper is to explore how to enhance gld performance
using massive unlabeled gastroscopic images to overcome the labeled data
shortage problem. the main challenge for this goal is the characteristic of
gastroscopic lesions. intuitively, such a challenge requires local feature
representations to contain enough detailed information, meanwhile preserving
discriminability. enlightened by this, we propose the self-and semi-supervised
learning (ssl) framework tailored to address challenges in daily clinical
practice and use massive unlabeled data to enhance gld performance. ssl
overcomes the challenges of gld by leveraging a large volume of unlabeled
gastroscopic images using self-supervised learning for improved feature
representations and semi-supervised learning to discover and utilize potential
lesions to enhance performance. specifically, it consists of a hybrid
self-supervised learning (hsl) method for self-supervised backbone pre-training
and a prototype-based pseudo-label generation (ppg) method for semi-supervised
detector training. the hsl combines the dense contrastive learning [10] with the
patch reconstruction to inherit the advantages of discriminative feature
learning and grasp the detailed information that is important for gld tasks. the
ppg generates pseudo-labels based on the similarity to the prototype feature
vectors (formulated from the feature vectors in its memory module) to discover
potential lesions from unlabeled data, and avoid introducing much noise at the
same time. moreover, we propose the first large-scale gld datasets (lgldd),
which contains 10,083 gastroscopic images with 12,292 well-annotated lesion
bounding boxes of four categories of lesions (polyp, ulcer, cancer, and
sub-mucosal tumor). we evaluate ssl with multiple detectors on lgldd and ssl
brings significant improvement compared with baseline methods (centernet [6]:
+2.7ap, faster rcnn [13]: +2.0ap). in summary, our contributions include:-a
self-and semi-supervise learning (ssl) framework to leverage massive unlabeled
data to enhance gld performance. -a large-scale gastroscopic lesion detection
datasets (lgldd) -experiments on lgldd demonstrate that ssl can bring
significant enhancement compared with baseline methods.",5
1143,Self- and Semi-supervised Learning for Gastroscopic Lesion Detection,3.0,Datasets,"we contribute the first large-scale gstroscopic lesion detection datasets
(lgldd) in the literature. collection : lgmdd collects about 1m+ gastroscopic
images from 2 hospitals of about 500 patients and their diagnosis reports. after
consulting some senior doctors and surveying gastroscopic diagnosis papers [1],
we select to annotate 4-category lesions: polyp(pol), ulcer(ulc), cancer(can)
and sub-mucosal tumor(smt). we invite 10 senior doctors to annotate them from
the unlabeled endoscopic images. to preserve the annotation quality, doctors can
refer to the diagnosis reports, and each lesion is annotated by a doctor and
checked by another. finally, they annotates 12,292 lesion boxes in 10,083 images
after going through about 120,000 images. the polyp, ulcer, cancer, and
sub-mucosal tumor numbers are 7,779, 2,171, 1,164and 1,178, respectively. the
train/val split of lgmdd is 8,076/2,007. the other data serves as unlabeled
data.evaluation metrics : we use standard object detection metrics to evaluate
the gld performance, which computes the average precision (ap) under multiple
intersection-of-union (iou) thresholds and then evaluate the performance using
the mean of aps (map) and the ap of some specific iou threshold. for map, we
follow the popular object detection datasets coco [11] and calculate the mean of
11 aps of iou from 0.5 to 0.95 with stepsize 0.05 (map @[.5:.05:.95]).we also
report ap under some specific iou threshold (ap 50 for .5, ap 75 for .75) and ap
of different scale lesions (ap s , ap m , ap l ) like coco [11].",5
