,title,header_no,header_title,text,volume
2014,A Texture Neural Network to Predict the Abnormal Brachial Plexus from Routine Magnetic Resonance Imaging,2.1,Dataset Preparation and Preprocessing,"following irb approval for this study, we search for patients with metastatic
breast cancer who had a breast cancer mri performed between 2010 and 2020 and
had morphologically positive bp on the mri report from our electronic medical
records (emr) in * hospital. totally, we collect approximate 807 series which
include 274 t2, 254 t1 and 279 post-gadolinium. since some scans are seriously
degraded due to motion artifacts. therefore, each case underwent several
essential image adjustments such as multi-series splitting, two-series merging,
slice swapping, artifact checking and boundary corrections. to yield the roi,
firstly, we randomly sampled -40% of the sequences including both normal and
abnormal ones that were manually segmented with itk-snap by two skilled trainees
[14,15]. then, the manual segmentations were utilized to train a 3d nnunet model
which was utilized to train the model which was used to predict rois for the
rest series [16]. the predicted segmentations were manually divided into three
groups, i.e. good, fair and poor. good cases were added to the training set.
this process was repeated until no improvements in the predictions for the
remaining sequences was seen. the final dataset for radiomic analysis was
constructed by merging the datasets for each sequence type. only patients that
had all three sequences segmented (t2, t1 and post-gadolinium) were included in
the dataset. table 1 shows a breakdown of the final dataset.",8
2065,Prompt-Based Grouping Transformer for Nucleus Detection and Classification,3.1,Datasets and Implementation Details,"consep 1 [10] is a colorectal nuclear dataset with three types, consisting of 41
h&e stained image tiles from 16 colorectal adenocarcinoma whole-slide images
(wsis). the wsis are at 20× magnification and the size of the slides is 500 ×
500. we split them following the official partition [1,10].is a breast cancer
dataset with three types and consists of 120 image tiles from 113 patients. the
wsis are at 20× magnification and the size of the slides ranges from 465 × 465
to 504 × 504. we follow the work [1] to apply the slic [2] algorithm to generate
superpixels as instances and split them into 80/10/30 slides for
training/validation/testing.lizard 3 [9] has 291 histology images of colon
tissue from six datasets, containing nearly half a million labeled nuclei in h&e
stained colon tissue. the wsis are at 20× magnification with an average size of
1,016 × 917 pixels. our implementation and the setting of hyper-parameters are
based on mmdetection [5]. the number of grouping prompts g is 64. random crop,
flipping, and scaling are used for data augmentation. our method is trained with
pytorch on a 48 gb gpu (nvidia a100) for 12-24 h (depending on the dataset
size). more details are listed in the supplementary material.",8
2081,Simulation of Arbitrary Level Contrast Dose in MRI Using an Iterative Global Transformer Model,1,Introduction,"gadolinium-based contrast agents (gbcas) are widely used in mri scans owing to
their capability of improving the border delineation and internal morphology of
different pathologies and have extensive clinical applications [1]. however,
gbcas have several disadvantages like contraindications in patients with reduced
renal function [2], patient inconvenience, high operation costs and
environmental side effects [3]. therefore, there is an increased emphasis on the
paradigm of ""as low as reasonably achievable"" (alara) [4]. to tackle these
concerns of gbcas, several dose reduction [5,6] and elimination approaches [7]
have been proposed. however, these deep learning(dl)-based dose reduction
approaches require high quality low-dose contrast-enhanced (ce) images paired
with pre-contrast and full-dose ce images. acquiring such a dataset requires
modification of the standard imaging protocol and involves additional training
of the mr technicians. therefore, it is important to simulate the process of t1w
low-dose image acquisition, using images from the standard protocol. moreover,
it is crucial for these dose reduction approaches to establish the minimum dose
level required for different pathologies as these are dependent on the scanning
protocol and the gbca compound injected. therefore the simulation tool should
also have the ability to synthesize images with multiple contrast enhancement
levels, that correspond to multiple arbitrary dose levels.currently mri dose
simulation is done using physics-based models [8]. however, these physics-based
methods are dependent on the protocol parameters and the type of gbca and their
relaxation parameters. deep learning (dl) models have been widely used in
medical imaging application due to their high capacity, generazibility, and
transferability [9,10]. the performance of these dl models heavily depend on the
availability of high quality data. there is a dearth of datadriven approaches to
mri dose-simulation given the lack of diverse ground truth data of the different
dose levels. to this effect, we introduce a vision transformer based dl model1
that can synthesize brain 2 mri images that correspond to arbitrary dose levels,
by training on a highly imbalanced dataset with only t1w pre-contrast, t1w 10%
low-dose, and t1w ce standard dose images. the model backbone consists of a
novel global transformer (gformer) with subsampling attention that can learn
long-range dependencies of contrast uptake features. the proposed method also
consists of a rotational shift operation that can further capture the shape
irregularity of the contrast uptake regions. we performed extensive quantitative
evaluation in comparison to other state-of-the art methods. additionally, we
show the clinical utility of the simulated t1w low-dose images using downstream
tasks. to the best of our knowledge, this is the first dl based mri dose
simulation approach.",8
2085,Simulation of Arbitrary Level Contrast Dose in MRI Using an Iterative Global Transformer Model,3,Experiments and Results,"dataset: with irb approval and informed consent, we retrospectively used 126
clinical cases (113 training, 13 testing) from a internal private dataset3 using
gadoterate meglumine contrast agent (site a). for downstream task assessment we
used 159 patient studies from another site (site b) using gadobenate
dimeglumine. the detailed cohort description is given in table 1. the clinical
indications for both sites included suspected tumor, post-op tumor follow-up and
routine brain. for each patient, 3d t1w mprage scans were acquired for the
pre-contrast, low-dose, and post-contrast images. these paired images were then
mean normalized and affine co-registered (pre-contrast as the fixed image) using
simpleelastix [17]. the images were also skull-stripped, to account for
differences in fat suppression, using the hd-bet brain extraction tool [18] for
generating the ""soft labels"". evaluation settings: we quantitatively evaluated
the proposed model using psnr, ssim, rmse, and lpips perceptual metrics [19],
between the synthesized and true low-dose images. we replaced the gformer
backbone with other state-of-the-art methods to compare the efficacy of the
different methods. particularly, the following backbone networks were studied:
simple linear scaling (""scaling"") approach, rednet [20], mapnn [13], restormer
[21], and swinir [22]. unet [23] and swin-unet [24] models were not assessed due
to their tendency to synthesize blurry artifacts in the iterative modelling.
throughput metric (number of images generated per second) was also calculated to
assess the inference efficiency.evaluation results: figure 4(a) shows that the
proposed model is able to generate images that correspond to different dose
levels. as shown in the zoomed inset, the hyperintensity of the contrast uptake
in these images gradually reduces at each iteration. figure 4(b) shows that the
pathological structure in the synthesized low-dose image is similar to that of
the ground truth. figure 4(c) also shows that the model is robust to
hyperintensities that are not related to contrast uptake. figure 3 and table 2
show that proposed model can synthesize enhancement patterns that look close to
the true low-dose and that it performs better than the other competing methods
with a reasonable inference throughput. quantitative assessment of contrast
uptake: the above pixel-based metrics do not specifically focus on the contrast
uptake region. in order to assess the contrast uptake patterns of the
intermediate images, we used the following metrics as described in [25]:
contrast to noise ratio(cnr), contrast to background ratio(cbr), and contrast
enhancement percentage(cep). the roi for the contrast uptake was computed as the
binary mask of the corresponding ""soft labels"" in eq. 2. as shown in fig. 5, the
value of the contrast specific metrics increases in a non-linear fashion as the
iteration step increases. downstream tasks: in order to demonstrate the clinical
utility of the synthesized low-dose images, we performed two downstream tasks:
1) low-dose to full-dose synthesis using the dl-based algorithm to predict
full-dose image from pre-contrast and low-dose images described in [5], we
synthesized t1ce volumes using true low-dose (t1ce-real-ldose) and gformer (rot)
synthesized low-dose (t1ce-synth-ldose). we computed the psnr and ssim metrics
of t1ce vs t1ce-synth/t1ce vs t1ce-synth-sim which are 29.82 ± 3.90 db/28.10 ±
3.20 db and 0.908 ± 0.031/0.892 ± 0.026 respectively. this shows that the
synthesized low-dose images perform similar4 to that of the low-dose image in
the dose reduction task. for this analysis we used the data from site b. 2)
tumor segmentation using the t1ce volumes synthesized in the above step, we
perform tumor segmentation using the winning solution of brats 2018 challenge
[26]. let m true , m ldose and m ldose-sim be the whole tumor (wt) masks
generated using t1ce, t1ce-real-ldose and t1ce-synth-ldose (+ t1, t2 and flair
images) respectively. the mean dice scores dice(m true , m ldose ) and dice(m
true , m ldose-sim ) on the test set were 0.889±0.099 and 0.876±0.092
respectively. figure 6 shows visual examples of tumor segmentation performance.
this shows that the clinical utility provided by the synthesized low-dose is
similar5 to that of the actual low-dose image.",8
2095,TractCloud: Registration-Free Tractography Parcellation with a Novel Local-Global Streamline Point Cloud Representation,0,Table 3 .,"works on unregistered tractography from neonate brains (much smaller than adult
brains). in the challenging btp (tumor patients) dataset, tractcloud reg-free
obtains significantly lower tda values than sota methods and comparable
performance to tractcloud regist . as shown in table2, our registration-free
framework is much faster than other compared methods.",8
2105,Relaxation-Diffusion Spectrum Imaging for Probing Tissue Microarchitecture,3.3,In Vivo Data: Neurite Morphology,"figure 4(a) shows the relaxation times of the restricted compartment in white
matter lesions, indicating that relaxation times are longer in gliomas than
normal white matter tissue. the higher t 2 in grade 4 glioma is associated with
changes in metabolite compositions, resulting in remarkable changes in neurite
morphology in lesioned tissues (fig. 4(c-d)), consistent with previous
observations [12,23]. the rate of longitudinal relaxation time has been shown to
be positively correlated with myelin content. our results indicate that mte dmri
is more sensitive to neurite morphology than ste dmri (fig. 4(b)).figures 4(c-d)
show that the estimated mean nr in the gray matter is approximately in the range
of 10 µm, which is in good agreement with the sizes of somas in human brains,
i.e., 11 ± 7 µm [26]. rdsi improves the detection of small metastases,
delineation of tumor extent, and characterization of the intratumoral
microenvironment when compared to conventional microstructure models (fig.
4(c)). our studies suggest that rdsi provides useful information on
microvascularity and necrosis helpful for facilitating early stratification of
patients with gliomas (fig. 4(d)).",8
2120,Brain Anatomy-Guided MRI Analysis for Assessing Clinical Progression of Cognitive Impairment with Structural MRI,2,Materials and Proposed Method,"data and preprocessing. the pretext model is trained via a tissue segmentation
task on auxiliary mris (without category label) from adni. a total of 9,544
t1-weighted mris from 2,370 adni subjects with multiple scans are used in this
work. to provide accurate brain anatomy, we perform image preprocessing and
brain tissue segmentation for these mris to generate ground-truth segmentation
of three tissues, i.e., white matter (wm), gray matter (gm) and cerebrospinal
fluid (csf), using an in-house toolbox ibeat [16] with manual verification.the
downstream model is trained on 1) a late-life depression (lld) study with 309
subjects from two sites [17,18], and 2) a type 2 diabetes mellitus (dm) study
with 82 subjects from the first affiliated hospital of guangzhou university of
chinese medicine. subjects in lld are categorized into three groups: 1) 89
non-depressed cognitively normal (cn), 2) 179 depressed but cognitively normal
(cnd), 3) 41 depressed subjects (called ci) who developed cognitive impairment
or even dementia in the follow-up years. category labels in the lld study are
determined based on subjects' 5-year follow-up diagnostic information, while
mris are acquired at baseline time. the dm contains 1) 45 health control (hc)
subjects and 2) 37 diabetes mellitus patients with mild ci (mci). detailed image
acquisition protocols are given in table si of supplementary materials. all mris
are preprocessed via the following pipeline: 1) bias field correction, 2) skull
stripping, 3) affine registration to the mni space, 4) resampling to 1 × 1 × 1
mm 3 , 5) deformable registration to aal3 [19] with syn [20], and 6) warping 166
regions-of-interest (rois) of aal3 back to mri volumes.proposed method. while it
is often challenging to annotate mris in practice, there are a large number of
mris (without task-specific category labels) in existing large-scale datasets.
even without category labels, previous studies propose to extract anatomical
features (e.g., roi volumes of gm segmentation maps) to characterize brain
anatomy [21,22]. such brain anatomy prior learned via tissue segmentation can be
employed to boost learning performance intuitively. accordingly, we propose a
brain anatomy-guided representation (bar) learning framework for progression
prediction of cognitive impairment, incorporated with brain anatomy prior
provided by brain tissue segmentation. as shown in fig. 1, the bar consists of a
pretext model for brain tissue segmentation and a downstream model for disease
progression prediction, both equipped with brain anatomy-guided encoders (shared
weights) for mri feature learning.(1) pretext model for segmentation. to learn
brain anatomical features from mris in a data-driven manner, we propose to
employ a segmentation task for pretext model training. as shown in the top of
fig. 1, the pretext model consists of 1) a brain anatomy-guided encoder for mri
feature extraction and 2) a decoder for segmentation. the brain anatomy-guided
encoder takes large-scale auxiliary 3d mris without category labels as input,
and outputs 512 feature maps. it contains 8 convolution blocks, with each block
containing a convolution layer (kernel size: 3 × 3 × 3), followed by instance
normalization and parametric rectified linear unit (prelu) activation. the first
4 blocks downsample the input with a stride of 2 × 2 × 2. the channel numbers of
the eight blocks are [64, 128, 256, 512, 512, 512, 512, 512], respectively. a
skip connection is applied to sum the input and output of every two of the last
4 blocks for residual learning.the decoder takes the 512 feature maps as input
and outputs segmentation maps of three tissues (i.e., wm, gm, and csf), thus
guiding the encoder to learn brain anatomical features. the decoder contains
four deconvolution blocks with 256, 128, 64 and 4 channels, respectively. each
deconvolution block shares the same architecture as the convolution block in the
encoder. the output of the decoder is then fed into a softmax layer to get four
probability maps that indicate the probability of a voxel belonging to a
specific tissue (i.e., background, wm, gm, and csf). besides, the reconstruction
task can be used to train the pretext model instead of segmentation when lacking
ground-truth segmentation maps. for problems without ground-truth segmentation
maps, we can resort to an mri reconstruction task to train the pretext model in
an unsupervised manner.(2) downstream model for prediction. as shown in the
bottom panel of fig. 1, the downstream model takes target mris as input and
outputs probabilities of category labels. it consists of 1) a brain
anatomy-guided encoder and 2) a predictor for prognosis. this encoder shares the
same architecture and parameters as that of the pre-trained pretext model. with
the encoder frozen, predictor parameters will be updated when the downstream
model is trained on target mris. the predictor has two convolution blocks
(kernel size: 3 × 3 × 3, stride: 2 × 2 × 2, channel: 256) with a skip
connection, followed by a flatten layer, an fc layer, and a softmax layer. the
architecture of the predictor can be flexibly adjusted according to the
requirements of different downstream tasks.(3) implementation. the proposed bar
is trained via two steps. 1) the pretext model is first trained on 9,544 mris
from adni, with ground-truth segmentation as supervision. the adam optimizer
[23] with a learning rate of 10 -4 and dice loss are used for training (batch
size: 4, epoch: 30). 2) we then share sii of supplementary materials. such
partition is repeated five times independently to avoid any bias introduced by
random partition, and the mean and standard deviation results are recorded. the
training data is duplicated and augmented using random affine transform. five
evaluation metrics are used, including area under roc curve (auc), accuracy
(acc), sensitivity (sen), specificity (spe), and f1-score (f1s). besides, we
perform tissue segmentation by directly applying the trained pretext model to
target mris from lld and dm studies and visually compare the results of our bar
with those of fsl [24].competing methods. we compare our bar with two classic
machine learning methods and five sota deep learning approaches, including (1)
support vector machine (svm) [25] with a radial basis function kernel
(regularization: 1.0), ( 2) xgboost (xgb) [26] (estimators: 300, tree depth: 4,
learning rate: 0.2), (3) resnetx with x convolution layers, (4) med3dx [27] with
x convolution layers, (5) seresnet [28] that is an improved model by adding
squeeze and excitation blocks to resnet, (6) efficientnet [29], and (7)
mobilenet [30] that is an efficient lightweight cnn model. for svm and xgb, we
extract roibased wm and gm volumes of each mri as input. all competing deep
learning methods (with default architectures) take whole 3d mris as input and
share the same training strategy as that used in the downstream model of the
bar. an early-stop training strategy (epoch: 90) is used in all deep learning
models. results of depression and ci identification. in this task, we aim to
recognize cognitively normal subjects with depression with a higher risk of
progressing to ci than healthy subjects. the results of fourteen methods on the
lld study are reported in table 1, where '*' denotes that the results of bar and
a competing method are statistically significantly different (p < 0.05 via
paired t-test).from the left of table 1, we have the following observations on
cnd vs. cn classification. first, our bar model generally outperforms thirteen
competing methods in most cases. for instance, the bar yields the results of auc
= 70.5% and sen = 77.3%, which are 4.1% and 10.0% higher than those of the
secondbest methods (i.e., seresnet and resnet50), respectively. this implies
that the brain anatomical mri features learned by our pretext model on
large-scale datasets would be more discriminative, compared with those used in
the competing methods. second, among 10 deep models, our bar produces the lowest
standard deviation in most cases (especially on sen and spe), suggesting its
robustness to bias introduced by random data partition in the downstream task.
this could be due to the strong generalizability of the feature encoder guided
by brain anatomy prior (derived from the auxiliary tissue segmentation task). in
addition, our bar significantly outperforms four machine learning methods and
two lightweight deep models (i.e., efficientnet and mobilenet) with p <
0.05.from the right of table 1, we can see that the overall results of fourteen
methods in ci vs. cnd classification are usually worse than cnd vs. cn
classification. this suggests that the task of ci vs. cnd classification is more
challenging, which could be due to the more imbalanced training data in this
task (as shown in table sii of supplementary materials). on the other hand, the
proposed bar still performs best in terms of auc=64.5% and spe=67.0%, which are
2.8% and 2.0% higher than those of the second-best competing methods (i.e.,
xgb-wm and resnet34), respectively. these results further demonstrate the
superiority of the bar in mri-based depression recognition.results of mci
detection. the results of different methods in mci detection (i.e., mci vs. hc
classification) on the dm study are reported in table 2. there are a total of 42
subjects (i.e., 17 mci and 25 hc) used for training in this task, which are
fewer but more balanced than the two tasks in the lld study (see table sii). it
can be observed from tables 1 and2 that the proposed bar yields relatively lower
standard deviations in terms of auc and acc in mci vs. hc classification,
compared with the two tasks on the lld study. these results imply that data
imbalance may be an important issue affecting the performance of deep learning
models when the number of training samples is limited.segmentation results. the
pre-trained pretext model can also be used for brain tissue segmentation in
downstream studies. thus, we visualize brain segmentation maps generated by fsl
and our bar for target mris in both lld and dm studies in fig. 2. note that
t1-weighted mris in the lld study are collected from 2 sites and have more
inconsistent image quality when compared to those from dm. from fig. 2, we have
several interesting observations.first, the segmentation results generated by
the proposed bar are generally better than those of fsl in most cases,
especially for those cortical surface areas on the two studies. for instance,
the wm region in segmentation maps generated by our bar is much cleaner than
that of fsl, indicating that our model is not sensitive to noise in mri. even
for the lld study with significant inter-site data heterogeneity, the boundary
of wm and gm produced by bar is more continuous and smoother, which is in line
with the brain anatomy prior. second, for mris with severe motion artifacts in
the lld study (ids: 1240, 1334, and 1653), our method can produce high-quality
segmentation maps, and the results are even comparable to those of mris without
motion artifacts. this demonstrates that our model is robust to motion
artifacts. the underlying reason could be that the pretext model is trained on
large-scale mris, and thus, has good generalization ability when applied to mris
with different image quality. in addition, both bar and fsl often achieve better
results in the dm study, since dm has relatively higher image quality than lld.
still, the proposed bar can achieve better segmentation results in many
fine-grained brain regions, such as the putamen region (see hc001 and mci003)
and the vermis region (see hc004). these results demonstrate that our method has
good adaptability when applied to classification and segmentation tasks in
mri-based studies.ablation study. to validate the effectiveness of the learned
brain anatomical mri features, we further compare the bar with its two variants
(called bar-b and bar-r) that use anatomy prior derived from different pretext
tasks in cnd vs. cn classification on lld. specifically, the bar-b is trained
from scratch as a baseline on target data without any pre-trained encoder. the
bar-r trains the pretext model through an mri reconstruction task in an
unsupervised learning manner. as shown in fig. 3(a), the bar consistently
performs better than its variants in terms of all five metrics. this implies
that the learned mri features guided by the segmentation task help promote
prediction performance. also, bar and bar-r outperform bar-b in most cases,
implying that brain anatomy prior derived from tissue segmentation or mri
reconstruction can help improve discriminative ability of mri features and boost
prediction performance.influence of training data size. we also study the
influence of training data size on bar in cnd vs. cn classification on lld. with
fixed test data, we randomly select a part of mris (i.e., [20%, 40%, • • • ,
100%]) from target training data to fine-tune the downstream prediction model.
it can be observed from fig. 3(b) that the overall performance in terms of auc
and acc of our bar increases with the increase of training data, and it produces
the best results when using all training data for model fine-tuning. this
suggests that using more data for downstream model fine-tuning helps promote
learning performance.",8
