,title,header_no,header_title,text,volume
1506,Triangular Analysis of Geographical Interplay of Lymphocytes (TriAnGIL): Predicting Immunotherapy Response in Lung Cancer,0,Results:,"the two top predictive triangil features were found to be the number of edges
between stroma and cd4+ cells, and the number of edges between stroma and tumor
cells with more interactions between stromal cells and both cd4+ and tumor cells
being associated with response to io. this finding is concordant with other
studies [13,17,22,27] that stromal tils were significantly associated with
improved os. therefore, triangil approach is not only predictive of treatment
response but more critically it enables biological interpretations that a dl
model might not be able to provide. in s v , this lda classifier was able to
distinguish responders from non-responders to io with au c t ri =0. design: s t
was used to construct a least absolute shrinkage and selection operator (lasso)
[28] regularized cox proportional hazards model [6] using the triangil features,
to obtain risk score for each patient. lasso features are listed in supplemental
table 4. the median risk score in s t was used as a threshold in both s t and s
v to dichotomize patients into low-risk/high-risk categories. kaplan-meier (km)
survival curves [26] were plotted and the model performance was summarized by
hazard ratio (hr), with corresponding (95% confidence intervals (ci)) using the
log-rank test, and harrell's concordance index (c-index) on s v . the c-index
evaluates the correlation between risk predictions and survival times, aiming to
maximize the discrimination between high-risk and low-risk patients [11]. os is
the time between the initiation of io to the death of the patient. the patients
were censored if the date of death was unknown.result: figure 2 presents some
triangil features in a field of view for a patient with long-term survival and
another with short-term survival. more triangular relationships, shorter
triangle edges, and smaller triangles with smaller perimeters are found in the
long-term survival case when analyzing the triadic interactions within
tumor-stroma-cd4, thereby suggesting higher relative presence and closer
interaction of these cell families. figure 3 illustrates the km plots for the
six approaches. we also calculated the concordance index (c-index) for the two
prognostic approaches in s v . the c-index for triangil and gnn methods were
0.64, and 0.63 respectively. therefore, overall triangil worked marginally
better than gnn, with much higher biological interpretability.",6
1507,Triangular Analysis of Geographical Interplay of Lymphocytes (TriAnGIL): Predicting Immunotherapy Response in Lung Cancer,5.0,Concluding Remarks,"we presented a new approach, triangular analysis of geographical interplay of
lymphocytes (triangil), to quantitatively chartacterize the spatial arrangement
and relative geographical interplay of multiple cell families across
pathological images. compared to previous spatial graph-based methods, triangil
quantifies the spatial interplay between multiple cell families, providing a
more comprehensive portrait of the tumor microenvironment. triangil was
predictive of response after io (n = 122) and also demonstrated a strong
correlation with os in nsclc patients treated with io (n = 135). triangil
outperformed other graph-and dl-based approaches, with the added benefit of
provoding interpretability with regard to the spatial interplay between cell
families. for instance, triangil yielded the insight that more interactions
between stromal cells and both cd4+ and tumor cells appears to be associated
with better response to io. although five cell families were studies in this
work, triangil is flexible and could include other cell types (e.g.,
macrophages). future work will entail larger validation studies and also
evaluation on other use cases.",6
1522,DiffDP: Radiotherapy Dose Prediction via a Diffusion Model,1.0,Introduction,"radiotherapy, one of the mainstream treatments for cancer patients, has gained
notable advancements in past decades. for promising curative effect, a
high-quality radiotherapy plan is demanded to distribute sufficient dose of
radiation to the planning target volume (ptv) while minimizing the radiation
hazard to organs at risk (oars). to achieve this, radiotherapy plans need to be
manually adjusted by the dosimetrists in a trial-and-error manner, which is
extremely labor-intensive and time-consuming [1,2]. additionally, the quality of
treatment plans might be variable among radiologists due to their different
expertise and experience [3]. consequently, it is essential to develop a robust
methodology to automatically predict the dose distribution for cancer patients,
relieving the burden on dosimetrists and accelerating the radiotherapy
procedure.recently, the blossom of deep learning (dl) has promoted the automatic
medical image processing tasks [4][5][6], especially for dose prediction
[7][8][9][10][11][12][13][14]. for example, nguyen et al. [7] modified the
traditional 2d unet [15] to predict the dose of prostate cancer patients. wang
et al. [10] utilized a progressive refinement unet (prunet) to refine the
predictions from low resolution to high resolution. besides the above unetbased
frameworks, song et al. [11] employed the deeplabv3+ [16] to excavate contextual
information from different scales, thus obtaining accuracy improvements in the
dose prediction of rectum cancer. mahmood et al. [12] utilized a generative
adversarial network (gan)-based method to predict the dose maps of oropharyngeal
cancer. furthermore, zhan et al. [13] designed a multi-organ constraint loss to
enforce the deep model to better consider the dose requirements of different
organs. following the idea of multi-task learning, tan et al. [8] utilized
isodose line and gradient information to promote the performance of dose
prediction of rectum cancer. to ease the burden on the delineation of ptv and
oars, li et al. [17] constructed an additional segmentation task to provide the
dose prediction task with essential anatomical knowledge.although the above
methods have achieved good performance in predicting dose distribution, they
suffer from the over-smoothing problem. these dl-based dose prediction methods
always apply the l 1 or l 2 loss to guide the model optimization which
calculates a posterior mean of the joint distribution between the predictions
and the ground truth [17,18], leading to the over-smoothed predicted images
without important high-frequency details [19]. we display predicted dose maps
from multiple deep models in fig. 1. as shown, compared with the ground truth,
i.e., (5) in fig. 1, the predictions from (1) to (3) are blurred with fewer
high-frequency details, such as ray shapes. these high-frequency features formed
by ray penetration reveal the ray directions and dose attenuation with the aim
of killing the cancer cells while protecting the oars as much as possible, which
are critical for radiotherapy. consequently, exploring an automatic method to
generate high-quality predictions with rich high-frequency information is
important to improve the performance of dose prediction. currently, diffusion
model [20] has verified its remarkable potential in modeling complex image
distributions in some vision tasks [21][22][23]. unlike other dl models, the
diffusion model is trained without any extra assumption about target data
distribution, thus evading the average effect and alleviating the over-smoothing
problem [24]. figure 1 (4) provides an example in which the diffusion-based
model predicts a dose map with shaper and clearer boundaries of ray-penetrated
areas. therefore, introducing a diffusion model to the dose prediction task is a
worthwhile endeavor.in this paper, we investigate the feasibility of applying a
diffusion model to the dose prediction task and propose a diffusion-based model,
called diffdp, to automatically predict the clinically acceptable dose
distribution for rectum cancer patients. specifically, the diffdp consists of a
forward process and a reverse process. in the forward process, the model employs
a markov chain to gradually transform dose distribution maps with complex
distribution into gaussian distribution by progressively adding pre-defined
noise. then, in the reverse process, given a pure gaussian noise, the model
gradually removes the noise in multiple steps and finally outputs the predicted
dose map. in this procedure, a noise predictor is trained to predict the noise
added in the corresponding step of the forward process. to further ensure the
accuracy of the predicted dose distribution for both the ptv and oars, we design
a dl-based structure encoder to extract the anatomical information from the ct
image and the segmentation masks of the ptv and oars. such anatomical
information can indicate the structure and relative position of organs. by
incorporating the anatomical information, the noise predictor can be aware of
the dose constraints among ptv and oars, thus distributing more appropriate dose
to them and generating more accurate dose distribution maps.overall, the
contributions of this paper can be concluded as follows: (1) we propose a novel
diffusion-based model for dose prediction in cancer radiotherapy to address the
over-smoothing issue commonly encountered in existing dl-based dose prediction
methods. to the best of our knowledge, we are the first to introduce the
diffusion model for this task. (2) we introduce a structure encoder to extract
the anatomical information available in the ct images and organ segmentation
masks, and exploit the anatomical information to guide the noise predictor in
the diffusion model towards generating more precise predictions. (3) the
proposed diffdp is extensively evaluated on a clinical dataset consisting of 130
rectum cancer patients, and the results demonstrate that our approach
outperforms other state-of-the-art methods.",6
1523,DiffDP: Radiotherapy Dose Prediction via a Diffusion Model,2.0,Methodology,"an overview of the proposed diffdp model is illustrated in fig. 2, containing
two markov chain processes: a forward process and a reverse process. an image
set of cancer patient is defined as {x, y}, where x ∈ r h ×w ×(2+o) represents
the structure images, ""2"" signifies the ct image and the segmentation mask of
the ptv, and o denotes the total number of segmentation mask of oars. meanwhile,
y ∈ r h ×w ×1 is the corresponding dose distribution map for x. concretely, the
forward process produces a sequence of noisy images {y 0 , y 1 , . . . , y t },
y 0 = y by gradually adding a small amount of noise to y in t steps with the
noise increased at each step and a noise predictor f is constructed to predict
the noise added to y t-1 by treating y t , anatomic information from x and
embedding of step t as input. to obtain the anatomic information, a structure
encoder g is designed to extract the crucial feature representations from the
structure images. then, in the reverse process, the model progressively deduces
the dose distribution map by iteratively denoising from y t using the
well-trained noise predictor.",6
1530,DiffDP: Radiotherapy Dose Prediction via a Diffusion Model,3.0,Experiments and Results,"dataset and evaluations. we measure the performance of our model on an in-house
rectum cancer dataset which contains 130 patients who underwent volumetric
modulated arc therapy (vmat) treatment at west china hospital. concretely, for
every patient, the ct images, ptv segmentation, oars segmentations, and the
clinically planned dose distribution are included. additionally, there are four
oars of rectum cancer containing the bladder, femoral head r, femoral head l,
and small intestine. we randomly select 98 patients for model training, 10
patients for validation, and the remaining 22 patients for test. the thickness
of the cts is 3 mm and all the images are resized to the resolution of 256 × 256
before the training procedure.we measure the performance of our proposed model
with multiple metrics. considering dm represents the minimal absorbed dose
covering m% percentage volume of ptv, we involve d 98 , d 2 , maximum dose (d
max ), and mean dose (d mean ) as metrics. besides, the heterogeneity index (hi)
is used to quantify dose heterogeneity [26]. to quantify performance more
directly, we calculate the difference ( ) of these metrics between the ground
truth and the predicted results. more intuitively, we involve the dose volume
histogram (dvh) [27] as another essential metric of dose prediction performance.
when the dvh curves of the predictions are closer to the ground truth, we can
infer higher prediction accuracy.comparison with state-of-the-art methods. to
verify the superior accuracy of our proposed model, we select multiple
state-of-the-art (sota) models in dose prediction, containing unet (2017) [7],
gan (2018) [12], deeplabv3+ (2020) [11], c3d (2021) [9], and prunet (2022) [10],
for comparison. the quantitative comparison results are listed in table . 1
where our method outperforms the existing sotas in terms of all metrics.
specifically, compared with deeplabv3+ with the second-best accuracy in hi
(0.0448) and d 98 (0.0416), the results generated by the proposed are 0.0035 and
0.0014 lower, respectively. as for d 2 and d max , our method gains overwhelming
performance with 0.0008 and 0.0005, respectively. moreover, the paired t-test is
conducted to investigate the significance of the results. the p-values between
the proposed and other sotas are almost all less than 0.05, indicating that the
enhancement of performance is statistically meaningful.besides the quantitative
results, we also present the dvh curves derived by compared methods in fig. 3.
the results are compared on ptv as well as two oars: bladder and small
intestine. compared with other methods, the disparity between the dvh curves of
our method and the ground truth is the smallest, demonstrating the superior
performance of the proposed. furthermore, we display the visualization
comparison in fig. 4. as we can see, the proposed model achieves the best visual
quality with clearer and sharper high-frequency details (as indicated by red
arrows). furthermore, the error map of the proposed is the darkest, suggesting
the least disparity compared with the ground truth.ablation study. to study the
contributions of key components of the proposed method, we conduct the ablation
experiments by 1) removing the structure encoder from the proposed method and
concatenating the anatomical images x and noisy image y t together as the
original input for diffusion model (denoted as baseline); 2) the proposed diffdp
model. the quantitative results are given in table 2. we can clearly see the
performance for all metrics is enhanced with the structure encoder,
demonstrating its effectiveness in the proposed model.",6
1531,DiffDP: Radiotherapy Dose Prediction via a Diffusion Model,4.0,Conclusion,"in this paper, we introduce a novel diffusion-based dose prediction (diffdp)
model for predicting the radiotherapy dose distribution of cancer patients. the
proposed method involves a forward and a reverse process to generate accurate
prediction by progressively transferring the gaussian noise into a dose
distribution map. moreover, we propose a structure encoder to extract anatomical
information from patient anatomy images and enable the model to concentrate on
the dose constraints within several essential organs. extensive experiments on
an in-house dataset with 130 rectum cancer patients demonstrate the superiority
of our method.",6
1532,Position-Aware Masked Autoencoder for Histopathology WSI Representation Learning,1.0,Introduction,"in the past few years, the development of histopathological whole slide image
(wsi) analysis methods has dramatically contributed to the intelligent cancer
diagnosis [4,10,15]. however, due to the limitation of hardware resources, it is
difficult to directly process gigapixel wsis in an end-to-end framework. recent
studies usually divide the wsi analysis into multiple stages.generally, multiple
instance learning (mil) is one of the most popular solutions for wsi analysis
[14,17,18]. mil methods regard wsi recognition as a weakly supervised learning
problem and focus on how to effectively and efficiently aggregate
histopathological local features into a global representation. several studies
introduced attention mechanisms [9], recurrent neural networks [2] and graph
neural network [8] to enhance the capacity of mil in structural information
mining. more recently, transformer-based structures [13,19] are proposed to
aggregate long-term relationships of tissue regions, especially for large-scale
wsis. these transformer-based models achieved state-of-the-art performance in
sub-type classification, survival prediction, gene mutant prediction, etc.
however, these methods still rely on at least patient-level annotations. in the
networkbased consultation and communication platforms, there is a vast quantity
of unlabeled wsis not effectively utilized. these wsis are usually without any
annotations or definite diagnosis descriptions but are available for
unsupervised learning. in this case, self-supervised learning (ssl) is gradually
introduced into the mil-based framework and is becoming a new paradigm for wsi
analysis [1,11,16]. typically, chen et al. [5] explored and posed a new
challenge referred to as slide-level self-learning and proposed hipt, which
leveraged the hierarchical structure inherent in wsis and constructed multiple
levels of the self-supervised learning framework to learn high-resolution image
representations. this approach enables mil-based frameworks to take advantage of
abundant unlabeled wsis, further improving the accuracy and robustness of tumor
recognition.however, hipt is a hierarchical learning framework based on a greedy
training strategy. the bias and error generated in each level of the
representation model will accumulate in the final decision model. moreover, the
vit [6] backbone used in hipt is originally designed for nature sense images in
fixed sizes whose positional information is consistent. however,
histopathological wsis are scale-varying and isotropic. the positional embedding
strategy of vit will bring ambiguity into the structural modeling. to relieve
this problem, kat [19] built hierarchical masks based on local anchors to
maintain multi-scale relative distance information in the training. but these
masks are manually defined which is not trainable and lacked orientation
information. the current embedding strategy for wsi structural description is
not complete.in this paper, we propose a novel whole slide image representation
learning framework named position-aware masked autoencoder (pama), which
achieves slide-level representation learning by reconstructing the local
representations of the wsi in the patch feature space. pama can be trained
end-to-end from the local features to the wsi-level representation. moreover, we
designed a position-aware cross-attention mechanism to guarantee the correlation
of localto-global information in the wsis while saving computational resources.
the proposed approach was evaluated on a public tcga-lung dataset and an
in-house endometrial dataset and compared with 6 state-of-the-art methods. the
results have demonstrated the effectiveness of the proposed method.the
contribution of this paper can be summarized into three aspects. (1) we propose
a novel whole slide image representation learning framework named position-aware
masked autoencoder (pama). pama can make full use of abundant unlabeled wsis to
learn discriminative wsi representations. (2) we propose a position-aware
cross-attention (paca) module with a kernel reorientation (kro) strategy, which
makes the framework able to maintain the spatial integrity and semantic
enrichment of slide representation during the selfsupervised training. (3) the
experiments on two datasets show our pama can achieve competitive performance
compared with sota mil methods and ssl methods.",6
1593,MPBD-LSTM: A Predictive Model for Colorectal Liver Metastases Using Time Series Multi-phase Contrast-Enhanced CT Scans,1.0,Introduction,"colorectal cancer is the third most common malignant tumor, and nearly half of
all patients with colorectal cancer develop liver metastasis during the course
of the disease [6,16]. liver metastases after surgery of colorectal cancer is
the major cause of disease-related death. colorectal cancer liver metastases
(crlm) have therefore become one of the major focuses in the medical field.
patients with colorectal cancer typically undergo contrast-enhanced computed
tomography (cect) scans multiple times during follow-up visits after surgery for
early detection of crlm, generating a 5d dataset. in addition to the axial,
sagittal, and coronal planes in 3d ct scans, the data comprises
contrast-enhanced multiple phases as its 4th dimension, along with different
timestamps as its 5th dimension. radiologists heavily rely on this data to
detect the crlm in the very early stage [15].extensive existing works have
demonstrated the power of deep learning on various spatial-temporal data, and
can potentially be applied towards the problem of crlm. for example, originally
designed for natural data, several mainstream models such as e3d-lstm [12],
convlstm [11] and predrnn [13] use convolutional neural networks (cnn) to
capture spatial features and long short-term memory (lstm) to process temporal
features. some other models, such as simvp [4], replace lstms with cnns but
still have the capability of processing spatiotemporal information. these models
can be adapted for classification tasks with the use of proper classification
head.however, all these methods have only demonstrated their effectiveness
towards 3d/4d data (i.e., time-series 2d/3d images), and it is not clear how to
best extend them to work with the 5d cect data. part of the reason is due to the
lack of public availability of such data. when extending these models towards 5d
cect data, some decisions need to be made, for example: 1) what is the most
effective way to incorporate the phase information? simply concatenating
different phases together may not be the optimal choice, because the positional
information of the same ct slice in different phases would be lost.2) shall we
use uni-directional lstm or bi-direction lstm? e3d-lstm [12] shows
uni-directional lstm works well on natural videos while several other works show
bi-directional lstm is needed in certain medical image segmentation tasks
[2,7].in this paper, we investigate how state-of-art deep learning models can be
applied to the crlm prediction task using our 5d cect dataset. we evaluate the
effectiveness of bi-directional lstm and explore the possible method of
incorporating different phases in the cect dataset. specifically, we show that
the best prediction accuracy can be achieved by enhancing e3d-lstm [12] with a
bi-directional lstm and a multi-plane structure. when patients undergo cect
scans to detect crlm, typically three phases are captured: the unenhanced plain
scan phase (p), the portal venous phase (v), and the arterial phase (a). the p
phase provides the basic shape of the liver tissue, while the v and a phases
provide additional information on the liver's normal and abnormal blood vessel
patterns, respectively [10]. professional radiologists often combine the a and v
phases to determine the existence of metastases since blood in the liver is
supplied by both portal venous and arterial routes.",6
1594,MPBD-LSTM: A Predictive Model for Colorectal Liver Metastases Using Time Series Multi-phase Contrast-Enhanced CT Scans,2.1,Dataset,"our dataset follows specific inclusion criteria:-no tumor appears on the ct
scans. that means patients have not been diagnosed as crlm when they took the
scans.-patients were previously diagnosed with colorectal cancer tnm stage i to
stage iii, and recovered from colorectal radical surgery. -patients have two or
more times of cect scans.-we already determined whether or not the patients had
liver metastases within 2 years after the surgery, and manually labeled the
dataset based on this. -no potential focal infection in the liver before the
colorectal radical surgery.-no metastases in other organs before the liver
metastases.-no other malignant tumors.our retrospective dataset includes two
cohorts from two hospitals. the first cohort consists of 201 patients and the
second cohort includes 68 patients. each scan contains three phases and 100 to
200 ct slices with a resolution of 512×512. patients may have different numbers
of ct scans, ranging from 2 to 6, depending on the number of follow-up visits.
ct images are collected with the following acquisition parameters: window width
150, window level 50, radiation dose 120 kv, slice thickness 1 mm, and slice gap
0.8 mm. all images underwent manual quality control to exclude any scans with
noticeable artifacts or blurriness and to verify the completeness of all slices.
additional statistics on our dataset are presented in table 1 and examples of
representative images are shown in fig. 1. the dataset is available upon
request.",6
