,age,gender,sex,women,woman,female,men,man,male,location,geolocation,geographical,geographic,region,country,countries,city,cities,hospital,hospitals,clinic,clinics,society,societies,demographic,demographics,etnicity,etnicities,race,bias,biases,fairness,transparency,data gap,data gaps,data bias,data biases
3D Arterial Segmentation via Single 2D Projections and Depth Supervision in Contrast-Enhanced CT Images,0,0,0,0,0,1,0,0,2,1,0,0,0,0,0,0,0,0,0,0,0,0,0,0,0,0,0,0,0,0,0,0,0,0,0,0,0
3D Mitochondria Instance Segmentation with Spatio-Temporal Transformers,0,0,0,0,0,0,1,3,0,0,0,0,0,4,0,0,0,0,0,0,0,0,0,0,0,0,0,0,0,0,0,0,0,0,0,0,0
A Spatial-Temporally Adaptive PINN Framework for 3D Bi-Ventricular Electrophysiological Simulations and Parameter Inference,1,0,0,0,0,1,0,0,2,0,0,0,0,0,0,0,0,0,1,0,0,0,0,0,0,0,0,0,0,0,0,0,0,0,0,0,0
A Texture Neural Network to Predict the Abnormal Brachial Plexus from Routine Magnetic Resonance Imaging,1,0,0,0,0,0,0,1,0,0,0,0,0,0,0,0,0,0,0,0,1,0,0,0,0,0,0,0,0,0,0,0,0,0,0,0,0
ALL-IN: A Local GLobal Graph-Based DIstillatioN Model for Representation Learning of Gigapixel Histopathology Images With Application In Cancer Risk Assessment,6,0,0,0,0,0,13,9,0,0,0,0,0,72,0,0,0,0,0,0,0,0,0,0,0,0,0,0,0,0,0,0,0,0,0,0,0
Adaptive Region Selection for Active Learning in Whole Slide Image Semantic Segmentation,1,0,0,0,0,0,0,0,0,4,0,0,0,2,0,0,0,0,0,0,0,0,0,0,0,0,0,0,0,1,0,0,0,0,0,0,0
Adaptive Supervised PatchNCE Loss for Learning H&E-to-IHC Stain Translation with Inconsistent Groundtruth Image Pairs,7,1,0,0,0,1,2,2,8,0,0,0,0,2,0,0,0,0,0,0,0,0,0,0,2,2,0,0,1,0,0,0,0,0,0,0,0
An AI-Ready Multiplex Staining Dataset for Reproducible and Accurate Characterization of Tumor Immune Microenvironment,1,0,0,0,0,0,1,1,0,1,0,0,0,0,0,0,0,0,0,0,0,0,0,0,0,0,0,0,0,1,0,0,0,0,0,0,0
An Anti-biased TBSRTC-Category Aware Nuclei Segmentation Framework with a Multi-label Thyroid Cytology Benchmark,2,0,0,0,0,0,0,0,0,0,0,0,0,1,0,0,0,0,1,1,1,0,0,0,0,0,0,0,0,1,0,0,0,0,0,0,0
An Explainable Deep Framework: Towards Task-Specific Fusion for Multi-to-One MRI Synthesis,0,0,0,0,0,0,1,1,0,0,0,0,0,2,0,0,0,0,0,0,1,1,0,0,0,0,0,0,0,0,0,0,0,0,0,0,0
An Explainable Geometric-Weighted Graph Attention Network for Identifying Functional Networks Associated with Gait Impairment,5,0,0,0,0,0,1,2,0,0,0,0,0,46,0,0,0,0,0,0,0,0,0,0,0,0,0,0,0,0,0,0,0,0,0,0,0
Anatomical-Aware Point-Voxel Network for Couinaud Segmentation in Liver CT,0,0,0,0,0,0,0,0,0,0,0,0,0,0,0,0,0,0,0,0,0,0,1,0,0,0,0,0,0,0,0,0,0,0,0,0,0
Anatomy-Informed Data Augmentation for Enhanced Prostate Cancer Detection,2,0,0,0,0,0,1,0,0,0,0,0,0,4,0,0,0,0,0,0,0,0,1,0,0,0,0,0,0,1,1,0,0,0,0,0,0
Anti-adversarial Consistency Regularization for Data Augmentation: Applications to Robust Medical Image Segmentation,7,0,0,0,0,0,0,0,0,0,0,0,0,15,0,0,0,0,0,0,0,0,0,0,0,0,0,0,0,0,0,0,0,0,0,0,0
ArSDM: Colonoscopy Images Synthesis with Adaptive Refinement Semantic Diffusion Models,1,0,0,0,0,0,0,0,0,3,0,0,0,1,0,0,0,0,0,0,0,0,0,0,0,0,0,0,0,0,0,0,0,0,0,0,0
Artifact Restoration in Histology Images with Diffusion Probabilistic Models,4,0,0,0,0,0,15,2,0,1,0,0,0,31,0,0,0,0,2,1,0,0,0,0,0,0,0,0,0,0,0,0,0,0,0,0,0
Automated CT Lung Cancer Screening Workflow Using 3D Camera,0,0,0,0,0,0,1,1,0,0,0,0,0,0,0,0,0,0,0,0,0,0,0,0,0,0,0,0,0,2,1,0,0,0,0,0,0
Automatic Bleeding Risk Rating System of Gastric Varices,0,0,0,0,0,0,3,1,0,0,0,0,0,5,0,0,0,0,3,3,1,0,0,0,0,0,0,0,0,1,0,1,0,0,0,0,0
B-Cos Aligned Transformers Learn Human-Interpretable Features,2,0,0,0,0,0,0,0,0,0,0,0,0,1,0,1,0,0,0,0,0,0,0,0,0,0,0,0,0,0,0,1,0,0,0,0,0
Black-box Domain Adaptative Cell Segmentation via Multi-source Distillation,3,0,0,2,0,0,3,1,0,0,0,0,0,0,0,0,0,0,0,0,0,0,0,0,0,0,0,0,0,3,1,0,0,0,0,0,0
Boosting Breast Ultrasound Video Classification by the Guidance of Keyframe Feature Centers,1,0,0,0,0,0,0,0,0,0,0,0,0,0,0,0,0,0,0,0,0,0,0,0,0,0,0,0,0,0,0,0,1,0,0,0,0
Bridging Ex-Vivo Training and Intra-operative Deployment for Surgical Margin Assessment with Evidential Graph Transformer,0,0,0,0,0,0,0,0,0,0,0,0,0,1,0,0,0,0,0,0,1,0,0,0,0,0,0,0,0,1,0,0,0,0,0,0,0
CARL: Cross-Aligned Representation Learning for Multi-view Lung Cancer Histology Classification,0,0,0,0,0,0,0,0,0,0,0,0,0,0,0,0,0,0,0,0,0,0,0,0,0,0,0,0,0,1,0,0,0,0,0,0,0
CLIP-Lung: Textual Knowledge-Guided Lung Nodule Malignancy Prediction,0,0,0,0,0,0,2,1,0,0,0,0,0,2,0,0,0,0,0,0,0,0,0,0,2,2,0,0,0,0,0,1,0,0,0,0,0
Cascade Transformer Encoded Boundary-Aware Multibranch Fusion Networks for Real-Time and Accurate Colonoscopic Lesion Segmentation,1,0,0,0,0,0,0,0,0,0,0,0,0,0,0,0,0,0,0,0,0,0,0,0,0,0,0,0,0,1,0,0,0,0,0,0,0
CellGAN: Conditional Cervical Cell Synthesis for Augmenting Cytopathological Image Classification,0,0,0,0,0,0,1,0,0,0,0,0,0,1,0,0,0,0,0,0,0,0,0,0,0,0,0,0,0,0,0,0,0,0,0,0,0
Centroid-Aware Feature Recalibration for Cancer Grading in Pathology Images,3,0,0,0,0,0,3,0,0,1,0,1,1,0,0,0,0,0,2,1,3,0,0,0,0,0,0,0,0,1,1,0,0,0,0,0,0
CircleFormer: Circular Nuclei Detection in Whole Slide Images with Circle Queries and Attention,1,0,0,0,0,0,0,0,0,0,0,0,0,1,0,0,1,0,4,0,0,0,0,0,0,0,0,0,0,0,0,0,0,0,0,0,0
Clinical Evaluation of AI-Assisted Virtual Contrast Enhanced MRI in Primary Gross Tumor Volume Delineation for Radiotherapy of Nasopharyngeal Carcinoma,6,0,2,0,0,0,4,0,0,1,0,0,1,0,0,0,0,0,1,0,0,0,0,0,3,0,0,0,0,0,0,0,0,0,0,0,0
Clustering Disease Trajectories in Contrastive Feature Space for Biomarker Proposal in Age-Related Macular Degeneration,0,0,0,0,0,0,0,0,0,0,0,0,0,1,0,0,0,0,0,0,0,0,0,0,0,0,0,0,0,0,0,0,0,0,0,0,0
Co-assistant Networks for Label Correction,3,0,0,0,0,0,0,0,0,0,0,0,0,1,0,0,0,0,0,0,0,0,0,0,0,0,0,0,0,0,0,0,0,0,0,0,0
Contrastive Feature Decoupling for Weakly-Supervised Disease Detection,2,0,0,0,0,0,1,0,0,0,0,0,0,0,0,0,0,0,1,1,0,0,0,0,0,0,0,0,0,0,0,0,0,0,0,0,0
Cross-Modulated Few-Shot Image Generation for Colorectal Tissue Classification,1,0,0,0,0,0,1,0,0,0,0,0,0,0,0,0,0,0,0,0,0,0,0,0,0,0,0,0,0,0,0,0,0,0,0,0,0
DARC: Distribution-Aware Re-Coloring Model for Generalizable Nucleus Segmentation,1,0,0,0,0,0,0,0,1,1,0,0,0,1,0,0,0,0,0,0,0,0,0,0,0,0,0,0,0,0,0,0,0,0,0,0,0
DAS-MIL: Distilling Across Scales for MIL Classification of Histological WSIs,1,0,0,0,0,0,0,0,0,0,0,0,0,1,0,0,0,0,0,0,0,0,0,0,0,0,0,0,0,2,0,0,0,0,0,0,0
Deep Cellular Embeddings: An Explainable Plug and Play Improvement for Feature Representation in Histopathology,1,0,0,0,0,0,1,0,0,0,0,0,0,6,0,0,0,0,0,0,0,0,0,0,0,0,0,0,0,0,0,0,0,0,0,0,0
Deep Learning for Tumor-Associated Stroma Identification in Prostate Histopathology Slides,0,0,0,0,0,0,0,0,0,0,0,0,0,3,0,0,0,0,0,0,0,0,0,0,0,0,0,0,0,0,0,0,0,0,0,0,0
Deep Learning-Based Anonymization of Chest Radiographs: A Utility-Preserving Measure for Patient Privacy,0,0,0,0,0,0,0,0,0,0,0,0,0,0,1,0,0,0,4,0,1,0,0,0,0,0,0,0,0,0,0,0,0,0,0,0,0
Deep Probability Contour Framework for Tumour Segmentation and Dose Painting in PET Images,0,0,0,0,0,0,0,0,0,1,0,0,0,0,0,0,0,0,0,0,0,0,0,0,0,0,0,0,0,0,0,0,0,0,0,0,0
Deep Unsupervised Clustering for Conditional Identification of Subgroups Within a Digital Pathology Image Set,1,0,0,0,0,0,1,0,0,0,0,0,0,2,0,0,0,0,0,0,0,0,0,0,0,0,0,0,0,4,0,6,0,0,0,0,0
Detecting Domain Shift in Multiple Instance Learning for Digital Pathology Using Fréchet Domain Distance,1,0,0,1,0,0,1,0,0,0,0,0,0,0,0,1,0,0,1,1,0,0,0,0,0,0,0,0,0,0,0,0,0,0,0,0,0
Detecting the Sensing Area of a Laparoscopic Probe in Minimally Invasive Cancer Surgery,1,0,0,1,0,0,4,0,0,0,0,0,0,0,0,0,0,0,2,0,1,0,0,0,0,0,0,0,0,0,0,0,0,0,0,0,0
Detection of Basal Cell Carcinoma in Whole Slide Images,0,0,0,0,0,0,1,1,0,0,0,0,0,0,0,0,0,0,1,0,0,0,0,0,0,0,0,0,0,0,0,0,0,0,0,0,0
Detection-Free Pipeline for Cervical Cancer Screening of Whole Slide Images,1,0,0,3,0,0,5,1,0,1,0,0,0,1,0,0,0,0,1,0,0,0,0,0,0,0,0,0,0,0,0,0,1,0,0,0,0
Developing Large Pre-trained Model for Breast Tumor Segmentation from Ultrasound Images,0,0,0,0,0,0,2,0,0,0,0,0,0,0,0,0,0,0,0,0,0,0,0,0,0,0,0,0,0,0,0,2,0,0,0,0,0
Dynamic Curriculum Learning via In-Domain Uncertainty for Medical Image Classification,0,0,0,0,0,0,1,2,0,0,0,0,0,0,0,0,0,0,0,0,0,0,0,0,0,0,0,0,0,2,0,1,0,0,0,0,0
ECL: Class-Enhancement Contrastive Learning for Long-Tailed Skin Lesion Classification,0,0,0,0,0,0,0,0,0,0,0,0,0,0,0,0,0,0,0,0,0,0,1,0,0,0,0,0,0,0,0,0,0,0,0,0,0
EGE-UNet: An Efficient Group Enhanced UNet for Skin Lesion Segmentation,0,0,0,0,0,0,1,1,0,0,0,0,0,0,0,0,0,0,0,0,0,0,0,0,0,0,0,0,0,9,0,0,0,0,0,0,0
EPVT: Environment-Aware Prompt Vision Transformer for Domain Generalization in Skin Lesion Recognition,3,0,0,0,0,0,10,8,0,0,0,0,0,0,0,0,0,0,0,0,0,0,0,0,0,0,0,0,0,7,1,18,0,0,0,0,0
EdgeMixup: Embarrassingly Simple Data Alteration to Improve Lyme Disease Lesion Segmentation and Diagnosis Fairness,2,0,0,4,0,0,6,0,0,0,0,0,0,0,0,0,0,0,0,0,1,0,0,0,0,0,0,0,0,0,0,0,0,0,0,0,0
Enhancing Breast Cancer Risk Prediction by Incorporating Prior Images,2,0,0,0,0,0,6,0,0,1,0,0,0,2,0,0,0,0,0,0,1,0,0,0,0,0,0,0,0,2,0,0,0,0,0,0,0
EoFormer: Edge-Oriented Transformer for Brain Tumor Segmentation,0,0,0,0,0,0,3,0,0,4,0,0,0,3,0,0,0,0,0,0,0,0,0,0,0,0,0,0,0,1,1,0,0,0,0,0,0
Factor Space and Spectrum for Medical Hyperspectral Image Segmentation,2,0,0,0,0,0,0,0,0,0,0,0,0,0,0,0,0,0,1,0,0,0,0,0,0,0,0,0,0,0,0,0,0,0,0,0,0
FocalErrorNet: Uncertainty-Aware Focal Modulation Network for Inter-modal Registration Error Estimation in Ultrasound-Guided Neurosurgery,0,0,0,0,0,0,0,0,0,0,0,0,0,2,0,0,0,0,0,0,0,0,0,0,0,0,0,0,0,3,0,0,0,0,0,0,0
FocalUNETR: A Focal Transformer for Boundary-Aware Prostate Segmentation Using CT Images,0,0,0,0,0,0,1,0,0,0,0,0,0,1,0,0,0,0,4,0,0,0,0,0,0,0,0,0,0,0,0,0,0,0,0,0,0
Foundation Model for Endoscopy Video Analysis via Large-Scale Self-supervised Pre-train,0,0,0,0,0,0,3,0,0,0,0,0,0,0,0,0,0,0,0,0,1,0,0,0,0,0,0,0,0,0,0,0,0,0,0,0,0
FreeSeed: Frequency-Band-Aware and Self-guided Network for Sparse-View CT Reconstruction,4,0,0,0,0,0,0,0,0,1,0,0,0,6,0,0,0,0,0,0,0,0,0,0,0,0,0,0,0,0,0,0,0,0,0,0,0
Gall Bladder Cancer Detection from US Images with only Image Level Labels,1,0,0,0,0,0,0,0,0,0,0,0,0,1,0,0,0,0,0,0,0,0,0,0,0,0,0,0,0,0,0,0,0,0,0,0,0
Geometric Ultrasound Localization Microscopy,0,0,0,0,0,0,1,0,0,1,0,0,0,2,0,0,0,0,0,0,0,0,0,0,0,0,0,0,0,0,0,0,0,0,0,0,0
Geometry-Invariant Abnormality Detection,0,0,0,0,0,0,0,0,0,3,0,0,0,1,0,0,0,0,0,0,0,0,0,0,0,0,0,0,0,0,0,0,0,0,0,0,0
H-DenseFormer: An Efficient Hybrid Densely Connected Transformer for Multimodal Tumor Segmentation,0,0,0,0,0,0,0,0,0,1,0,0,0,0,0,0,0,0,1,0,0,0,0,0,0,0,0,0,0,0,0,0,0,0,0,0,0
HENet: Hierarchical Enhancement Network for Pulmonary Vessel Segmentation in Non-contrast CT Images,0,0,0,0,0,0,2,0,0,1,0,0,0,13,0,0,0,0,0,0,0,0,0,0,0,0,0,0,0,0,0,0,0,0,0,0,0
HIGT: Hierarchical Interaction Graph-Transformer for Whole Slide Image Analysis,0,0,0,0,0,0,0,0,0,0,0,0,0,0,0,0,0,0,1,0,0,0,0,0,0,0,0,0,0,0,0,0,0,0,0,0,0
IIB-MIL: Integrated Instance-Level and Bag-Level Multiple Instances Learning with Label Disambiguation for Pathological Image Analysis,0,0,0,0,0,0,0,0,0,0,0,0,0,0,0,0,0,0,1,0,0,0,0,0,0,0,0,0,0,0,0,0,0,0,0,0,0
Imitation Learning from Expert Video Data for Dissection Trajectory Prediction in Endoscopic Surgical Procedure,2,0,1,0,0,1,0,1,2,1,0,0,0,3,0,0,0,0,3,0,1,0,0,0,0,0,0,0,0,0,0,0,0,0,0,0,0
Improved Prognostic Prediction of Pancreatic Cancer Using Multi-phase CT by Integrating Neural Distance and Texture-Aware Transformer,7,0,2,0,0,1,20,5,1,0,0,0,0,1,0,0,0,0,1,0,4,0,0,0,2,0,0,0,29,60,7,6,0,0,0,0,0
Improving Outcome Prediction of Pulmonary Embolism by De-biased Multi-modality Model,0,0,0,0,0,0,1,0,0,0,0,0,0,0,0,0,0,0,1,0,0,0,0,0,0,0,0,0,0,1,0,0,0,0,0,0,0
Infusing Physically Inspired Known Operators in Deep Models of Ultrasound Elastography,0,0,0,0,0,0,1,0,0,1,0,0,0,0,0,0,0,0,0,0,0,0,0,0,0,0,0,0,0,0,0,0,0,0,0,0,0
Interpretable Medical Image Classification Using Prototype Learning and Privileged Information,0,0,0,0,0,0,0,0,0,0,0,0,0,2,0,0,0,0,0,0,0,0,0,0,0,0,0,0,0,0,0,0,0,0,0,0,0
Intraoperative CT Augmentation for Needle-Based Liver Interventions,2,0,0,0,0,0,3,0,0,1,0,0,0,4,0,0,0,0,0,0,0,0,0,0,0,0,0,0,0,0,0,0,0,0,0,0,0
Iteratively Coupled Multiple Instance Learning from Instance to Bag Classifier for Whole Slide Image Classification,0,0,0,0,0,0,0,0,0,0,0,0,0,0,0,0,0,0,1,0,0,0,0,0,0,0,0,0,0,0,0,0,0,0,0,0,0
"Joint Prediction of Response to Therapy, Molecular Traits, and Spatial Organisation in Colorectal Cancer Biopsies",1,0,0,0,0,0,1,1,0,1,0,0,0,1,0,0,0,0,0,0,0,0,0,0,0,0,0,0,0,0,0,0,0,0,0,0,0
Label-Free Nuclei Segmentation Using Intra-Image Self Similarity,0,0,0,0,0,0,3,0,0,0,0,0,0,2,0,0,0,0,0,0,0,0,0,0,0,0,0,0,0,0,0,0,0,0,0,0,0
Laplacian-Former: Overcoming the Limitations of Vision Transformers in Local Texture Detection,0,0,0,0,0,0,0,0,0,0,0,0,0,1,0,0,0,0,0,0,0,0,0,0,0,0,0,0,0,0,0,0,0,0,0,0,0
LightNeuS: Neural Surface Reconstruction in Endoscopy Using Illumination Decline,0,0,0,0,0,0,0,0,0,1,0,0,0,1,0,0,0,0,0,0,0,0,0,0,0,0,0,0,0,0,0,0,0,0,0,0,0
Liver Tumor Screening and Diagnosis in CT with Pixel-Lesion-Patient Network,0,0,0,0,0,0,1,1,0,0,0,0,0,1,0,0,0,0,0,0,0,0,0,0,0,0,0,0,0,1,0,0,0,0,0,0,0
Longitudinal Multimodal Transformer Integrating Imaging and Latent Clinical Signatures from Routine EHRs for Pulmonary Nodule Classification,2,0,0,0,0,0,0,0,0,0,0,0,0,0,0,0,0,0,0,0,0,0,0,0,2,2,0,0,0,0,0,0,0,0,0,0,0
Low-Dose CT Image Super-Resolution Network with Dual-Guidance Feature Distillation and Dual-Path Content Communication,6,0,0,0,0,0,2,0,0,0,0,0,0,3,0,0,0,0,0,0,0,0,0,0,0,0,0,0,0,0,0,0,0,0,0,0,0
M&M: Tackling False Positives in Mammography with a Multi-view and Multi-instance Learning Sparse Detector,2,0,0,0,0,0,0,1,0,0,0,0,0,3,0,0,0,0,1,0,2,0,0,0,0,0,0,0,0,0,0,0,0,0,0,0,0
MDViT: Multi-domain Vision Transformer for Small Medical Image Segmentation Datasets,0,0,0,0,0,0,0,0,0,0,0,0,0,0,0,0,0,0,0,0,0,0,0,0,0,0,0,0,0,4,1,0,0,0,0,0,0
MPBD-LSTM: A Predictive Model for Colorectal Liver Metastases Using Time Series Multi-phase Contrast-Enhanced CT Scans,0,0,0,0,0,0,0,0,0,0,0,0,0,0,0,0,0,0,1,1,0,0,0,0,0,0,0,0,0,0,0,0,0,0,0,0,0
MSKdeX: Musculoskeletal (MSK) Decomposition from an X-Ray Image for Fine-Grained Estimation of Lean Muscle Mass and Muscle Volume,1,0,0,0,0,1,2,0,2,0,0,0,0,1,0,0,0,0,0,0,1,0,0,0,0,0,0,0,0,0,0,0,0,0,0,0,0
MUVF-YOLOX: A Multi-modal Ultrasound Video Fusion Network for Renal Tumor Diagnosis,2,0,0,0,0,0,1,0,0,0,0,0,0,1,0,0,0,0,2,0,0,0,0,0,0,0,0,0,0,0,0,0,0,0,0,0,0
Mammo-Net: Integrating Gaze Supervision and Interactive Information in Multi-view Mammogram Classification,1,0,0,1,0,0,2,0,0,0,0,0,0,0,0,0,0,0,1,1,0,0,0,0,0,0,0,0,0,0,0,0,0,0,0,0,0
Merging-Diverging Hybrid Transformer Networks for Survival Prediction in Head and Neck Cancer,6,1,0,0,0,0,3,1,0,0,0,0,0,17,0,0,0,0,0,0,1,0,0,0,0,0,0,0,0,0,0,0,0,0,0,0,0
Mesh2SSM: From Surface Meshes to Statistical Shape Models of Anatomy,0,0,0,0,0,0,0,0,0,0,0,0,0,0,0,0,0,0,0,0,0,0,0,0,0,0,0,0,0,3,0,0,0,0,0,0,0
Mining Negative Temporal Contexts for False Positive Suppression in Real-Time Ultrasound Lesion Detection,0,0,0,0,0,0,0,0,0,0,0,0,0,3,0,0,0,0,0,0,0,0,0,0,0,0,0,0,0,0,0,0,0,0,0,0,0
MixUp-MIL: Novel Data Augmentation for Multiple Instance Learning and a Study on Thyroid Cancer Diagnosis,2,1,0,0,0,1,0,0,2,0,0,0,0,0,0,0,0,0,1,0,1,0,0,0,0,0,0,0,0,0,0,0,0,0,0,0,0
MoCoSR: Respiratory Motion Correction and Super-Resolution for 3D Abdominal MRI,1,0,0,0,0,0,0,0,0,0,0,0,0,1,0,0,0,0,0,0,0,0,0,0,0,0,0,0,0,1,0,0,0,0,0,0,0
Morphology-Inspired Unsupervised Gland Segmentation via Selective Semantic Grouping,4,0,0,0,0,0,9,11,0,0,0,0,0,14,0,0,0,0,0,0,0,0,0,0,0,0,0,0,0,0,0,0,0,0,0,0,0
Multi-modal Pathological Pre-training via Masked Autoencoders for Breast Cancer Diagnosis,0,0,0,2,0,0,2,1,0,0,0,0,0,1,0,0,0,0,0,0,0,0,0,0,0,0,0,0,0,0,0,0,0,0,0,0,0
Multi-scale Prototypical Transformer for Whole Slide Image Classification,0,0,0,0,0,0,0,0,0,2,0,0,0,0,0,0,0,0,0,0,0,0,0,0,0,0,0,0,0,0,0,0,0,0,0,0,0
Multi-scale Self-Supervised Learning for Longitudinal Lesion Tracking with Optional Supervision,2,0,0,0,0,0,2,0,0,11,0,0,0,0,0,0,0,0,0,0,0,0,0,0,0,0,0,0,0,0,0,0,0,0,0,0,0
Multi-scope Analysis Driven Hierarchical Graph Transformer for Whole Slide Image Based Cancer Survival Prediction,0,0,0,0,0,0,0,0,0,0,0,0,0,0,0,1,0,0,1,0,0,0,0,0,0,0,0,0,0,0,0,0,0,0,0,0,0
Multi-task Learning of Histology and Molecular Markers for Classifying Diffuse Glioma,1,0,0,0,0,0,1,0,0,0,0,0,0,0,0,0,0,0,0,0,1,0,1,0,0,0,0,0,0,0,0,0,0,0,0,0,0
Multimodal CT and MR Segmentation of Head and Neck Organs-at-Risk,4,0,0,0,0,0,10,0,0,0,0,0,0,6,0,0,0,0,0,0,1,0,0,0,0,0,0,0,0,0,0,0,0,0,0,0,0
Multiple Prompt Fusion for Zero-Shot Lesion Detection Using Vision-Language Models,2,0,0,0,0,0,3,0,0,6,0,0,0,4,0,0,0,0,0,0,0,0,0,0,0,0,0,0,0,0,0,0,0,0,0,0,0
NASDM: Nuclei-Aware Semantic Histopathology Image Generation Using Diffusion Models,0,0,0,0,0,0,0,0,0,0,0,0,0,0,0,0,0,0,0,0,0,0,0,0,0,0,0,0,0,2,1,0,0,0,0,0,0
Noise2Aliasing: Unsupervised Deep Learning for View Aliasing and Noise Reduction in 4DCBCT,1,0,0,0,0,0,1,0,0,1,0,0,0,0,0,0,0,0,0,0,0,0,0,0,0,0,0,0,0,0,0,0,0,0,0,0,0
PET-Diffusion: Unsupervised PET Enhancement Based on the Latent Diffusion Model,2,0,0,1,0,0,3,1,0,0,0,0,0,0,0,0,0,0,0,0,3,0,0,0,0,0,0,0,0,1,0,0,0,0,0,0,0
PROnet: Point Refinement Using Shape-Guided Offset Map for Nuclei Instance Segmentation,0,0,0,0,0,0,0,0,0,2,0,0,0,1,0,0,0,0,0,0,0,0,0,0,0,0,0,0,0,0,0,0,0,0,0,0,0
Parse and Recall: Towards Accurate Lung Nodule Malignancy Prediction Like Radiologists,0,0,0,0,0,0,0,2,0,3,0,0,0,1,0,0,0,0,2,0,0,0,0,0,0,0,0,0,0,0,0,0,0,0,0,0,0
Pathology-and-Genomics Multimodal Transformer for Survival Outcome Prediction,1,0,0,0,0,0,0,0,0,0,0,0,0,1,0,0,0,0,0,0,0,0,0,0,0,0,0,0,0,0,0,0,0,0,0,0,0
Patients and Slides are Equal: A Multi-level Multi-instance Learning Framework for Pathological Image Analysis,0,0,0,0,0,0,0,0,0,0,0,0,0,0,0,0,0,0,0,0,0,0,0,0,0,0,0,0,0,1,0,0,0,0,0,0,0
Pick the Best Pre-trained Model: Towards Transferability Estimation for Medical Image Segmentation,0,0,0,0,0,0,0,0,0,0,0,0,0,1,0,0,0,0,0,0,0,0,0,0,0,0,0,0,0,0,0,0,0,0,0,0,0
Position-Aware Masked Autoencoder for Histopathology WSI Representation Learning,1,0,0,0,0,0,0,0,0,1,0,0,0,0,0,0,0,0,0,0,0,0,0,0,0,0,0,0,0,2,0,0,0,0,0,0,0
Progressive Attention Guidance for Whole Slide Vulvovaginal Candidiasis Screening,1,0,0,0,0,0,0,1,0,1,0,0,0,1,0,0,0,0,0,0,0,0,0,0,0,0,0,0,0,0,0,0,0,0,0,0,0
Prompt-Based Grouping Transformer for Nucleus Detection and Classification,3,0,0,2,0,0,4,2,0,1,0,0,0,1,0,0,0,0,0,0,0,0,0,0,0,0,0,0,0,0,0,0,0,0,0,0,0
Prompt-MIL: Boosting Multi-instance Learning Schemes via Task-Specific Prompt Tuning,0,0,0,0,0,0,0,0,0,2,0,0,0,0,0,0,0,0,0,0,0,0,0,0,0,0,0,0,0,0,0,0,0,0,0,0,0
Radiomics-Informed Deep Learning for Classification of Atrial Fibrillation Sub-Types from Left-Atrium CT Volumes,2,0,0,0,0,0,0,0,0,0,0,0,0,0,0,0,0,0,0,0,0,0,0,0,0,0,0,0,0,0,0,0,0,0,0,0,0
Regularized Kelvinlet Functions to Model Linear Elasticity for Image-to-Physical Registration of the Breast,0,0,0,0,0,0,0,0,0,1,0,0,0,2,0,0,0,0,1,0,0,0,0,0,0,0,0,0,0,0,0,0,0,0,0,0,0
Reveal to Revise: An Explainable AI Life Cycle for Iterative Bias Correction of Deep Models,0,0,0,0,0,0,0,0,0,3,0,0,0,0,0,0,0,0,0,0,0,0,0,0,0,0,0,0,0,0,0,0,0,0,0,0,0
Revealing Anatomical Structures in PET to Generate CT for Attenuation Correction,8,0,0,0,0,0,1,2,0,0,0,0,0,0,0,0,0,0,0,0,0,0,0,0,0,0,0,0,0,22,6,1,0,0,0,0,0
Revisiting Feature Propagation and Aggregation in Polyp Segmentation,1,0,0,0,0,0,0,0,0,0,0,0,0,0,0,0,0,0,0,0,1,1,0,0,0,0,0,0,0,0,0,0,0,0,0,0,0
Robust Cervical Abnormal Cell Detection via Distillation from Local-Scale Consistency Refinement,0,0,0,0,0,0,0,1,0,1,0,0,0,0,0,0,0,0,0,0,0,0,0,0,0,0,0,0,0,0,0,0,0,0,0,0,0
Robust T-Loss for Medical Image Segmentation,3,0,0,1,0,0,1,0,0,1,0,0,0,1,0,0,0,0,0,0,0,0,0,0,0,0,0,0,0,0,0,0,0,0,0,0,0
S2^2ME: Spatial-Spectral Mutual Teaching and Ensemble Learning for Scribble-Supervised Polyp Segmentation,2,0,0,0,0,0,1,1,0,1,0,0,0,0,0,0,0,0,0,0,0,0,0,0,0,0,0,0,0,1,0,0,0,0,0,0,0
SHISRCNet: Super-Resolution and Classification Network for Low-Resolution Breast Cancer Histopathology Image,0,0,0,0,0,0,0,0,0,1,0,0,0,0,0,0,0,0,0,0,0,0,0,0,0,0,0,0,0,0,0,0,0,0,0,0,0
SLPD: Slide-Level Prototypical Distillation for WSIs,1,0,0,3,0,0,3,0,0,0,0,0,0,0,0,0,0,0,0,0,0,0,0,0,0,0,0,0,0,0,0,0,0,0,0,0,0
SLPT: Selective Labeling Meets Prompt Tuning on Label-Limited Lesion Segmentation,14,0,0,0,0,0,3,12,0,0,0,0,0,45,0,0,0,0,0,0,0,0,0,0,0,0,0,0,0,2,0,0,0,0,0,0,0
Scale-Aware Test-Time Click Adaptation for Pulmonary Nodule and Mass Segmentation,1,0,0,0,0,0,0,1,0,0,0,0,0,0,0,0,0,0,5,0,0,0,0,0,0,0,0,0,0,0,0,1,0,0,0,0,0
Scribble-Based 3D Multiple Abdominal Organ Segmentation via Triple-Branch Multi-Dilated Network with Pixel- and Class-Wise Consistency,0,0,0,0,0,0,2,0,0,0,0,0,0,1,0,0,0,0,0,0,0,0,0,0,0,0,0,0,0,0,0,0,0,0,0,0,0
Second-Course Esophageal Gross Tumor Volume Segmentation in CT with Prior Anatomical and Radiotherapy Information,0,0,0,0,0,0,1,0,0,1,0,0,0,0,0,0,0,0,0,0,0,0,0,0,0,0,0,0,0,0,0,0,0,0,0,0,0
Segment Membranes and Nuclei from Histopathological Images via Nuclei Point-Level Supervision,3,0,0,0,0,0,1,0,0,2,0,0,0,9,0,0,0,0,1,1,0,0,0,0,0,0,0,0,0,0,0,0,0,0,0,0,0
Self- and Semi-supervised Learning for Gastroscopic Lesion Detection,2,0,0,0,0,0,2,1,0,0,0,0,0,17,0,0,0,0,0,0,0,0,0,0,0,0,0,0,0,0,0,0,0,0,0,0,0
Self-supervised Dense Representation Learning for Live-Cell Microscopy with Time Arrow Prediction,0,0,0,0,0,0,1,0,0,0,0,0,0,1,0,0,0,0,0,0,0,0,0,0,0,0,0,0,0,0,0,0,0,0,0,0,0
Self-supervised Learning for Endoscopic Video Analysis,0,0,0,0,0,0,0,0,0,1,0,0,0,0,0,0,0,0,0,0,0,0,0,0,0,0,0,0,0,1,0,0,0,0,0,0,0
Self-supervised Learning via Inter-modal Reconstruction and Feature Projection Networks for Label-Efficient 3D-to-2D Segmentation,2,0,0,0,0,0,1,0,0,0,0,0,0,0,0,0,0,0,0,0,0,0,0,0,0,0,0,0,0,0,0,0,0,0,0,0,0
Self-supervised Polyp Re-identification in Colonoscopy,1,0,0,0,0,0,0,0,0,0,0,0,0,0,0,0,0,0,0,0,0,0,0,0,0,0,0,0,0,2,0,0,0,0,0,0,0
Semi-supervised Pathological Image Segmentation via Cross Distillation of Multiple Attentions,0,0,0,0,0,0,4,0,0,19,0,0,0,0,0,0,0,0,0,0,0,0,0,0,0,0,0,0,0,0,0,0,0,0,0,0,0
Shifting More Attention to Breast Lesion Segmentation in Ultrasound Videos,1,0,0,1,0,0,2,0,0,3,0,0,0,1,0,0,0,0,0,0,0,0,0,0,0,0,0,0,0,0,0,0,0,0,0,0,0
SimPLe: Similarity-Aware Propagation Learning for Weakly-Supervised Breast Cancer Segmentation in DCE-MRI,5,0,0,0,0,0,1,2,0,0,0,0,0,2,0,0,0,0,1,0,8,0,0,0,0,0,0,0,0,1,0,0,0,0,0,0,0
Solving Low-Dose CT Reconstruction via GAN with Local Coherence,0,0,0,0,0,0,1,0,0,0,0,0,0,0,0,0,0,0,1,1,1,0,0,0,0,0,0,0,0,0,0,0,0,0,0,0,0
StructuRegNet: Structure-Guided Multimodal 2D-3D Registration,0,0,0,0,0,0,1,0,0,1,0,0,0,0,0,0,0,0,0,0,0,0,0,0,0,0,0,0,0,0,0,0,0,0,0,0,0
Structure-Preserving Instance Segmentation via Skeleton-Aware Distance Transform,2,0,0,0,0,0,0,0,0,0,0,0,0,4,0,0,0,0,0,0,0,0,0,0,0,0,0,0,0,0,0,0,0,0,0,0,0
Structure-Preserving Synthesis: MaskGAN for Unpaired MR-CT Translation,4,0,0,0,0,0,2,0,0,0,0,0,0,1,0,0,0,0,0,0,0,0,0,0,0,0,0,0,0,0,0,0,0,0,0,0,0
Structured State Space Models for Multiple Instance Learning in Digital Pathology,0,0,0,0,0,0,0,0,0,0,0,0,0,1,0,0,0,0,0,0,0,0,0,0,0,0,0,0,0,0,0,0,0,0,0,0,0
SwinUNETR-V2: Stronger Swin Transformers with Stagewise Convolutions for 3D Medical Image Segmentation,0,0,0,0,0,0,2,1,0,0,0,0,0,0,0,0,0,0,0,0,0,0,0,0,0,0,0,0,0,8,0,0,0,0,0,0,0
Synthesis of Contrast-Enhanced Breast MRI Using T1- and Multi-b-Value DWI-Based Hierarchical Fusion Network with Attention Mechanism,0,0,0,1,0,0,1,0,0,0,0,0,0,1,0,0,0,0,0,0,0,0,0,0,0,0,0,0,0,0,0,0,0,0,0,0,0
Synthetic Augmentation with Large-Scale Unconditional Pre-training,0,0,0,0,0,0,0,0,0,0,0,0,0,0,0,0,0,0,0,0,0,0,0,0,0,0,0,0,0,1,0,0,0,0,0,0,0
TPRO: Text-Prompting-Based Weakly Supervised Histopathology Tissue Segmentation,1,0,0,0,0,0,0,1,0,1,0,0,0,1,0,0,0,0,0,0,0,0,0,0,0,0,0,0,0,0,0,0,0,0,0,0,0
Text-Guided Cross-Position Attention for Segmentation: Case of Medical Image,1,0,0,0,0,0,1,1,0,1,0,0,0,3,0,0,0,0,0,0,0,0,0,0,0,0,0,0,0,0,0,0,0,0,0,0,0
Text-Guided Foundation Model Adaptation for Pathological Image Classification,2,0,0,0,0,0,0,1,0,0,0,0,0,0,0,0,0,0,0,0,0,0,0,0,0,0,0,0,0,0,0,0,0,0,0,0,0
The Role of Subgroup Separability in Group-Fair Medical Image Classification,16,0,9,0,0,4,4,13,8,1,0,0,1,0,0,0,0,0,0,0,1,0,0,0,0,0,0,0,4,43,1,12,1,0,0,0,0
Thinking Like Sonographers: A Deep CNN Model for Diagnosing Gout from Musculoskeletal Ultrasound,0,0,0,0,0,0,1,0,0,0,0,0,0,13,0,0,0,0,0,0,0,0,0,0,0,0,0,0,0,2,0,0,0,0,0,0,0
Thyroid Nodule Diagnosis in Dynamic Contrast-Enhanced Ultrasound via Microvessel Infiltration Awareness,0,0,0,0,0,0,1,0,0,0,0,0,0,1,0,0,0,0,2,0,0,0,0,0,0,0,0,0,0,0,0,0,0,0,0,0,0
Towards AI-Driven Radiology Education: A Self-supervised Segmentation-Based Framework for High-Precision Medical Image Editing,0,0,0,0,0,0,0,0,0,0,0,0,0,0,0,0,0,0,1,0,0,0,0,0,0,0,0,0,0,0,0,0,0,0,0,0,0
Towards Multi-modal Anatomical Landmark Detection for Ultrasound-Guided Brain Tumor Resection with Contrastive Learning,0,0,0,0,0,0,0,0,0,3,0,0,0,1,0,0,0,0,0,0,0,0,0,0,0,0,0,0,0,0,0,0,0,0,0,0,0
Towards Novel Class Discovery: A Study in Novel Skin Lesions Clustering,0,0,0,0,0,0,0,0,0,0,0,0,0,0,0,0,0,0,0,0,1,0,0,0,0,0,0,0,0,0,0,0,0,0,0,0,0
Trackerless Volume Reconstruction from Intraoperative Ultrasound Images,1,0,0,0,0,0,0,0,0,0,0,0,0,0,0,0,0,0,0,0,0,0,0,0,0,0,0,0,0,1,0,0,0,0,0,0,0
TransLiver: A Hybrid Transformer Model for Multi-phase Liver Lesion Classification,0,0,0,0,0,0,0,0,0,0,0,0,0,0,0,0,0,0,3,1,0,0,0,0,0,0,0,0,0,1,0,1,0,0,0,0,0
Transfer Learning-Assisted Survival Analysis of Breast Cancer Relying on the Spatial Interaction Between Tumor-Infiltrating Lymphocytes and Tumors,0,0,0,1,0,1,1,0,1,0,0,0,0,0,0,0,0,0,0,0,0,0,0,0,0,0,0,0,0,0,0,0,0,0,0,0,0
Triangular Analysis of Geographical Interplay of Lymphocytes (TriAnGIL): Predicting Immunotherapy Response in Lung Cancer,1,0,0,0,0,0,4,0,0,0,0,9,9,5,0,0,0,0,0,0,0,0,0,0,0,0,0,0,0,0,0,0,0,0,0,0,0
