,Title
5,Black-box Domain Adaptative Cell
6,Mesh2SSM: From Surface Meshes
10,Tracking Adaptation to Improve
21,Towards AI-Driven Radiology Education:
23,Adaptive Region Selection for Active
24,Synthetic Augmentation with Large-Scale
28,A Spatial-Temporal Deformable Attention
44,WeakPolyp: You only Look Bounding Box
51,Fine-Tuning Network in Federated
54,Diﬀusion Kinetic Model for Breast Cancer
56,H-DenseFormer: An Eﬃcient Hybrid
58,SwinUNETR-V2: Stronger Swin Transformers
70,Morphology-Inspired Unsupervised Gland
74,Enhancing Breast Cancer Risk Prediction
92,Parse and Recall: Towards Accurate Lung
95,Contrastive Feature Decoupling
103,Triangular Analysis of Geographical
104,Adaptive Supervised PatchNCE Loss
110,Instance-Aware Diﬀusion Model
117,An Anti-biased TBSRTC-Category Aware
133,Detection of Basal Cell Carcinoma
157,Deep Unsupervised Clustering
159,Diﬀusion-Based Data Augmentation
