,age,gender,sex,women,woman,female,male,geolocation,geographical,geographic,country,countries,city,cities,hospital,hospitals,clinic,clinics,society,societies,etnicity,etnicities,race,bias,biases,fair,unfair,fairness,transparency,imbalance,imbalanced,balance,balanced
3D Arterial Segmentation via Single 2D Projections and Depth Supervision in Contrast-Enhanced CT Images,0,0,0,0,0,1,2,0,0,0,0,0,0,0,0,0,0,0,0,0,0,0,0,0,0,2,1,0,0,0,0,0,0
3D Dental Mesh Segmentation Using Semantics-Based Feature Learning with Graph-Transformer,0,0,0,0,0,0,0,0,0,0,0,0,0,0,0,0,0,0,0,0,0,0,0,0,0,2,0,0,0,0,0,0,0
3D Medical Image Segmentation with Sparse Annotation via Cross-Teaching Between 3D and 2D Networks,0,0,0,0,0,0,0,0,0,0,0,0,0,0,0,0,0,0,0,0,0,0,0,0,0,1,0,0,0,0,0,0,0
3D Mitochondria Instance Segmentation with Spatio-Temporal Transformers,1,0,0,0,0,1,2,0,0,0,0,0,0,0,1,0,0,0,0,0,0,0,0,0,0,1,0,0,0,0,0,0,0
3D Teeth Reconstruction from Panoramic Radiographs Using Neural Implicit Functions,1,0,0,0,0,0,0,0,0,0,0,0,0,0,0,0,1,0,0,0,0,0,0,0,0,0,0,0,0,0,0,2,2
A Closed-Form Solution to Electromagnetic Sensor Based Intraoperative Limb Length Measurement in Total Hip Arthroplasty,1,0,0,0,0,0,0,0,0,0,0,0,0,0,0,0,0,0,0,0,0,0,0,0,0,0,0,0,0,0,0,1,0
A Conditional Flow Variational Autoencoder for Controllable Synthesis of Virtual Populations of Anatomy,0,0,0,0,0,0,0,0,0,0,0,0,0,0,0,0,0,0,0,0,0,0,0,1,0,0,0,0,0,0,0,0,0
A Coupled-Mechanisms Modelling Framework for Neurodegeneration,2,1,0,0,0,1,8,0,0,0,0,0,0,0,0,0,0,0,0,0,0,0,1,0,0,0,0,0,0,0,0,0,0
A Denoised Mean Teacher for Domain Adaptive Point Cloud Registration,1,0,0,0,0,0,0,0,0,0,0,0,0,0,0,0,0,0,0,0,0,0,0,1,0,0,0,0,0,1,1,2,2
A Flexible Framework for Simulating and Evaluating Biases in Deep Learning-Based Medical Image Analysis,1,0,0,0,0,0,0,0,0,0,0,0,0,0,1,1,1,0,0,0,0,0,0,1,0,0,0,0,0,0,0,0,0
A General Stitching Solution for Whole-Brain 3D Nuclei Instance Segmentation from Microscopy Images,0,0,0,0,0,0,0,0,0,0,0,0,0,0,0,0,1,1,0,0,0,0,0,0,0,0,0,0,0,0,0,0,0
A Model-Agnostic Framework for Universal Anomaly Detection of Multi-organ and Multi-modal Images,0,0,0,0,0,0,0,0,0,0,0,0,0,0,0,0,0,0,0,0,0,0,0,0,0,0,0,0,0,0,0,0,0
A Modulatory Elongated Model for Delineating Retinal Microvasculature in OCTA Images,0,0,0,0,0,0,0,0,0,0,0,0,0,0,0,0,0,0,1,0,0,0,0,0,0,0,0,0,0,0,0,1,1
A Motion Transformer for Single Particle Tracking in Fluorescence Microscopy Images,2,0,0,0,0,0,0,0,0,0,0,0,0,0,0,0,0,0,0,0,0,0,0,0,0,1,0,0,0,1,0,1,0
A Multi-task Method for Immunofixation Electrophoresis Image Classification,2,0,0,0,0,0,0,0,0,0,0,0,0,0,0,0,0,0,1,0,0,0,0,1,1,0,0,0,0,1,0,1,0
A Multi-task Network for Anatomy Identification in Endoscopic Pituitary Surgery,0,0,0,0,0,0,0,0,0,0,0,0,0,0,0,0,0,0,0,0,0,0,0,0,0,1,0,0,0,0,0,0,0
A Multimodal Disease Progression Model for Genetic Associations with Disease Dynamics,0,0,0,0,0,0,0,0,0,0,0,0,0,0,0,0,0,0,0,0,0,0,0,0,0,0,0,0,0,0,0,0,0
A Novel Multi-task Model Imitating Dermatologists for Accurate Differential Diagnosis of Skin Diseases in Clinical Images,0,0,0,0,0,0,0,0,0,0,0,0,0,0,2,1,0,0,0,0,0,0,0,0,0,0,0,0,0,0,0,0,0
A Novel Video-CTU Registration Method with Structural Point Similarity for FURS Navigation,0,0,0,0,0,0,0,0,0,0,0,0,0,0,0,0,0,0,0,0,0,0,0,2,1,0,0,0,0,0,0,0,0
A One-Class Variational Autoencoder (OCVAE) Cascade for Classifying Atypical Bone Marrow Cell Sub-types,0,0,0,0,0,0,0,0,0,0,0,0,0,0,3,3,1,0,0,0,0,0,0,1,0,1,0,1,0,0,0,0,0
A Patient-Specific Self-supervised Model for Automatic X-Ray/CT Registration,2,0,0,0,0,0,0,0,0,0,0,1,1,0,0,0,0,0,0,0,0,0,0,0,0,1,0,1,0,1,1,1,1
A Privacy-Preserving Walk in the Latent Space of Generative Models for Medical Applications,3,0,0,2,0,0,0,0,0,0,0,0,0,0,0,0,0,0,0,0,0,0,0,3,1,0,0,0,0,0,0,0,0
A Reliable and Interpretable Framework of Multi-view Learning for Liver Fibrosis Staging,4,0,0,0,0,0,0,0,0,0,0,0,1,0,0,0,0,0,0,0,0,0,0,0,0,0,0,0,1,0,0,4,3
A Semantic-Guided and Knowledge-Based Generative Framework for Orthodontic Visual Outcome Preview,0,0,0,0,0,0,0,0,0,0,0,0,0,0,0,0,0,0,0,0,0,0,0,0,0,0,0,0,0,0,0,1,0
A Sheaf Theoretic Perspective for Robust Prostate Segmentation,0,0,0,0,0,0,0,0,0,0,0,0,0,0,0,0,1,0,0,0,0,0,0,1,0,0,0,0,0,0,0,0,0
A Small-Sample Method with EEG Signals Based on Abductive Learning for Motor Imagery Decoding,0,0,0,0,0,0,0,0,0,0,0,0,0,0,0,0,0,0,0,0,0,0,0,1,0,0,0,0,0,0,0,0,0
A Spatial-Temporal Deformable Attention Based Framework for Breast Lesion Detection in Videos,0,0,0,0,0,0,0,0,0,0,0,0,0,0,0,0,0,0,0,0,0,0,0,0,0,1,0,1,0,0,0,0,0
A Spatial-Temporally Adaptive PINN Framework for 3D Bi-Ventricular Electrophysiological Simulations and Parameter Inference,1,0,0,0,0,0,0,0,0,0,0,0,0,0,0,0,0,0,0,0,0,0,0,1,0,0,0,0,0,0,0,0,0
A Style Transfer-Based Augmentation Framework for Improving Segmentation and Classification Performance Across Different Sources in Ultrasound Images,0,0,0,0,0,0,0,0,0,0,0,0,0,0,0,0,0,0,0,0,0,0,0,0,0,0,0,0,0,0,0,0,0
A Texture Neural Network to Predict the Abnormal Brachial Plexus from Routine Magnetic Resonance Imaging,0,0,0,0,0,0,0,0,0,0,0,0,0,0,0,0,0,0,0,0,0,0,0,0,0,0,0,0,0,0,0,0,0
A Transfer Learning Approach to Localising a Deep Brain Stimulation Target,2,0,0,0,0,0,0,0,1,1,0,0,0,0,2,1,3,0,0,0,0,0,0,1,1,0,0,0,0,0,0,0,0
A Unified Deep-Learning-Based Framework for Cochlear Implant Electrode Array Localization,0,0,0,0,0,0,0,0,0,0,0,0,1,0,4,0,0,0,0,0,0,0,0,0,0,0,0,0,0,0,0,1,0
A Video-Based End-to-end Pipeline for Non-nutritive Sucking Action Recognition and Segmentation in Young Infants,5,0,2,0,0,0,0,0,0,1,0,0,0,0,1,0,0,0,0,0,0,0,0,0,0,0,0,0,0,0,0,0,0
A2FSeg: Adaptive Multi-modal Fusion Network for Medical Image Segmentation,0,0,0,0,0,0,0,0,0,0,0,0,0,0,0,0,0,0,0,0,0,0,0,0,0,1,0,0,0,0,0,0,0
ACC-UNet: A Completely Convolutional UNet Model for the 2020s,1,0,0,0,0,0,0,0,0,0,0,0,0,0,0,0,0,0,0,0,0,0,0,0,0,3,0,0,0,0,0,0,0
ACT-Net: Anchor-Context Action Detection in Surgery Videos,0,0,0,0,0,0,0,0,0,0,0,0,0,0,0,0,0,0,0,0,0,0,0,0,0,0,0,0,0,0,0,0,0
ACTION++: Improving Semi-supervised Medical Image Segmentation with Adaptive Anatomical Contrast,2,0,0,0,0,0,0,0,0,0,0,0,0,0,1,1,0,0,0,0,0,0,0,0,0,0,0,0,0,0,0,0,0
ALL-IN: A Local GLobal Graph-Based DIstillatioN Model for Representation Learning of Gigapixel Histopathology Images With Application In Cancer Risk Assessment,1,0,0,0,0,0,0,0,0,0,0,0,0,0,0,0,0,0,0,0,0,0,0,0,0,0,0,0,0,0,0,0,0
AMAE: Adaptation of Pre-trained Masked Autoencoder for Dual-Distribution Anomaly Detection in Chest X-Rays,0,0,0,0,0,0,1,0,0,0,0,0,0,0,0,0,0,0,0,0,0,0,0,0,0,0,0,0,0,0,0,0,0
AME-CAM: Attentive Multiple-Exit CAM for Weakly Supervised Segmentation on MRI Brain Tumor,1,0,0,0,0,0,0,0,0,0,0,0,0,0,0,0,0,0,0,0,0,0,0,2,0,0,0,0,0,0,0,0,0
AR2T: Advanced Realistic Rendering Technique for Biomedical Volumes,0,0,0,0,0,0,0,0,0,0,0,0,0,0,0,0,0,0,0,0,0,0,0,0,0,0,0,0,0,0,0,1,0
ASC: Appearance and Structure Consistency for Unsupervised Domain Adaptation in Fetal Brain MRI Segmentation,0,0,0,0,0,0,0,0,0,0,0,0,0,0,0,0,0,0,0,0,0,0,0,0,0,0,0,0,0,0,0,0,0
ASCON: Anatomy-Aware Supervised Contrastive Learning Framework for Low-Dose CT Denoising,0,0,0,0,0,0,0,0,0,0,0,0,0,0,0,0,0,0,0,0,0,0,0,0,0,0,0,0,0,0,0,0,0
AUA-dE: An Adaptive Uncertainty Guided Attention for Diffusion MRI Models Estimation,0,0,0,0,0,0,0,0,0,0,1,0,0,0,4,0,1,0,0,0,0,0,0,0,0,0,0,0,0,0,0,0,0
Accurate Multi-contrast MRI Super-Resolution via a Dual Cross-Attention Transformer Network,0,0,0,0,0,0,0,0,0,0,0,0,0,0,0,0,0,0,0,0,0,0,0,0,0,0,0,0,0,0,0,0,0
Accurate and Robust Patient Height and Weight Estimation in Clinical Imaging Using a Depth Camera,1,0,0,0,0,0,0,0,0,0,0,0,0,0,0,0,0,0,0,0,0,0,0,4,0,9,2,6,0,1,0,4,3
Acute Ischemic Stroke Onset Time Classification with Dynamic Convolution and Perfusion Maps Fusion,1,0,0,1,0,0,0,0,0,0,0,1,0,0,1,1,0,0,0,0,0,0,0,0,0,1,0,0,0,0,0,1,0
Adapter Learning in Pretrained Feature Extractor for Continual Learning of Diseases,1,0,0,1,0,0,0,0,0,0,0,0,0,0,2,0,1,0,0,0,0,0,0,0,0,0,0,0,0,0,0,0,0
Adaptive Multi-scale Online Likelihood Network for AI-Assisted Interactive Segmentation,0,0,0,0,0,0,0,0,0,0,0,0,0,0,1,0,0,0,0,0,0,0,0,0,0,0,0,0,0,0,0,0,0
Adaptive Region Selection for Active Learning in Whole Slide Image Semantic Segmentation,1,0,0,3,0,0,0,0,0,0,0,0,0,0,1,0,0,0,0,0,0,0,0,0,0,0,0,0,1,0,0,0,0
Adaptive Supervised PatchNCE Loss for Learning H&E-to-IHC Stain Translation with Inconsistent Groundtruth Image Pairs,0,0,0,0,0,0,0,0,0,0,0,0,0,0,0,0,0,0,0,0,0,0,0,0,0,2,0,2,0,0,0,0,0
Additional Positive Enables Better Representation Learning for Medical Images,0,0,0,0,0,0,0,0,0,0,0,0,0,0,0,0,0,0,0,0,0,0,0,0,0,0,0,0,0,0,0,0,0
Adjustable Robust Transformer for High Myopia Screening in Optical Coherence Tomography,0,0,0,0,0,0,0,0,0,0,0,0,0,0,0,0,0,0,0,0,0,0,0,0,0,1,0,0,0,0,0,0,0
Adult-Like Phase and Multi-scale Assistance for Isointense Infant Brain Tissue Segmentation,0,0,0,0,0,0,0,0,0,0,0,0,0,0,0,0,0,0,0,0,0,0,0,0,0,0,0,0,0,1,0,1,0
AirwayFormer: Structure-Aware Boundary-Adaptive Transformers for Airway Anatomical Labeling,7,0,0,0,0,0,0,0,0,0,0,0,0,0,0,0,0,0,0,0,0,0,0,4,0,1,0,1,0,27,27,48,47
Alias-Free Co-modulated Network for Cross-Modality Synthesis and Super-Resolution of MR Images,0,0,0,0,0,0,0,0,0,0,0,0,0,0,0,0,0,0,1,0,0,0,0,0,0,0,0,0,0,0,0,0,0
An AI-Ready Multiplex Staining Dataset for Reproducible and Accurate Characterization of Tumor Immune Microenvironment,0,0,0,0,0,0,0,0,0,0,0,0,0,0,0,0,0,0,0,0,0,0,0,9,0,1,0,0,0,0,0,0,0
An Anti-biased TBSRTC-Category Aware Nuclei Segmentation Framework with a Multi-label Thyroid Cytology Benchmark,3,0,0,0,0,0,0,0,0,0,0,0,0,0,0,0,1,0,0,0,0,0,0,7,1,19,0,18,0,3,3,3,3
"An Auto-Encoder to Reconstruct Structure with Cryo-EM Images via Theoretically Guaranteed Isometric Latent Space, and Its Application for Automatically Computing the Conformational Pathway",2,0,0,4,0,0,0,0,0,0,0,0,0,0,0,0,1,0,0,0,0,0,0,0,0,0,0,0,0,0,0,0,0
An Automated Pipeline for Quantitative T2* Fetal Body MRI and Segmentation at Low Field,1,0,0,0,0,0,0,0,0,0,0,0,0,0,0,0,0,0,0,0,0,0,0,2,0,0,0,0,0,0,0,0,0
An Explainable Deep Framework: Towards Task-Specific Fusion for Multi-to-One MRI Synthesis,0,0,0,0,0,0,0,0,0,0,0,0,0,0,0,0,0,0,0,0,0,0,0,1,1,0,0,0,0,3,3,3,3
An Explainable Geometric-Weighted Graph Attention Network for Identifying Functional Networks Associated with Gait Impairment,0,0,0,0,0,0,0,0,0,0,0,0,0,0,0,0,0,0,0,0,0,0,0,0,0,0,0,0,0,0,0,0,0
An Interpretable and Attention-Based Method for Gaze Estimation Using Electroencephalography,2,0,0,0,0,0,0,0,0,0,0,0,0,0,1,0,0,0,0,0,0,0,0,0,0,0,0,0,0,0,0,0,0
An Unsupervised Multispectral Image Registration Network for Skin Diseases,0,0,0,0,0,0,0,0,0,0,0,0,0,0,0,0,0,0,0,0,0,0,0,0,0,0,0,0,0,0,0,0,0
Analysis of Suture Force Simulations for Optimal Orientation of Rhomboid Skin Flaps,0,0,0,0,0,0,0,0,0,0,0,0,0,0,0,0,0,0,0,0,0,0,0,3,0,0,0,0,0,0,0,0,0
Anatomical Landmark Detection Using a Multiresolution Learning Approach with a Hybrid Transformer-CNN Model,0,0,0,0,0,0,0,0,0,0,0,0,0,0,4,0,0,0,0,0,0,0,0,0,0,1,0,0,0,0,0,0,0
Anatomical-Aware Point-Voxel Network for Couinaud Segmentation in Liver CT,0,0,0,0,0,0,0,0,0,0,0,0,0,0,0,0,1,0,0,0,0,0,0,0,0,0,0,0,0,0,0,0,0
Anatomy-Driven Pathology Detection on Chest X-rays,0,0,0,0,0,0,0,0,0,0,0,0,0,0,0,0,0,0,0,0,0,0,0,0,0,0,0,0,0,0,0,0,0
Anatomy-Informed Data Augmentation for Enhanced Prostate Cancer Detection,0,0,0,0,0,0,0,0,0,0,0,0,0,0,0,0,0,0,0,0,0,0,0,0,0,1,0,0,0,0,0,0,0
Aneurysm Pose Estimation with Deep Learning,0,0,0,0,0,0,0,0,0,0,0,0,0,0,0,0,0,0,0,0,0,0,0,0,0,0,0,0,0,0,0,0,0
AngioMoCo: Learning-Based Motion Correction in Cerebral Digital Subtraction Angiography,0,0,0,0,0,0,0,0,0,0,0,0,0,0,0,0,0,0,0,0,0,0,0,0,0,0,0,0,0,0,0,0,0
Annotator Consensus Prediction for Medical Image Segmentation with Diffusion Models,0,0,0,0,0,0,0,0,0,0,0,0,0,0,0,0,0,0,0,0,0,0,0,0,0,0,0,0,0,0,0,0,0
Anti-adversarial Consistency Regularization for Data Augmentation: Applications to Robust Medical Image Segmentation,0,0,0,0,0,0,0,0,0,0,0,0,0,0,0,0,0,0,0,0,0,0,0,0,0,0,0,0,0,0,0,0,0
ArSDM: Colonoscopy Images Synthesis with Adaptive Refinement Semantic Diffusion Models,0,0,0,0,0,0,0,0,0,0,0,0,0,0,0,0,0,0,0,0,0,0,0,0,0,1,0,0,0,1,0,3,0
Ariadnes Thread: Using Text Prompts to Improve Segmentation of Infected Areas from Chest X-ray Images,0,0,0,0,0,0,0,0,0,0,0,0,0,0,1,0,0,0,0,0,0,0,0,0,0,1,0,0,0,0,0,0,0
Artifact Restoration in Histology Images with Diffusion Probabilistic Models,0,0,0,0,0,0,0,0,0,0,0,0,0,0,0,0,0,0,0,0,0,0,0,0,0,0,0,0,0,0,0,0,0
Assignment Theory-Augmented Neural Network for Dental Arch Labeling,0,0,0,0,0,0,0,0,0,0,0,0,0,0,1,0,0,0,0,0,0,0,0,0,0,0,0,0,0,0,0,1,0
Asymmetric Contour Uncertainty Estimation for Medical Image Segmentation,0,0,0,0,0,0,0,0,0,0,0,0,0,0,0,0,0,0,0,0,0,0,0,0,0,0,0,0,0,0,0,0,0
Attentive Deep Canonical Correlation Analysis for Diagnosing Alzheimers Disease Using Multimodal Imaging Genetics,0,0,0,0,0,0,0,0,0,0,0,0,0,0,1,0,0,0,0,0,0,0,0,0,0,0,0,0,0,0,0,0,0
Automated CT Lung Cancer Screening Workflow Using 3D Camera,2,0,1,0,0,1,2,0,0,0,0,0,0,0,3,0,1,0,0,0,0,0,0,0,0,0,0,0,0,0,0,0,0
Automatic Bleeding Risk Rating System of Gastric Varices,6,0,2,0,0,1,1,0,0,0,0,0,0,0,1,0,4,0,0,0,0,0,29,60,7,11,2,6,0,0,0,3,1
Automatic Retrieval of Corresponding US Views in Longitudinal Examinations,0,0,0,0,0,0,0,0,0,0,0,0,0,0,1,0,0,0,0,0,0,0,0,1,0,0,0,0,0,0,0,0,0
Automatic Segmentation of Internal Tooth Structure from CBCT Images Using Hierarchical Deep Learning,0,0,0,0,0,0,0,0,0,0,0,0,0,0,0,0,0,0,0,0,0,0,0,0,0,0,0,0,0,0,0,2,0
Automatic Surgical Reconstruction for Orbital Blow-Out Fracture via Symmetric Prior Anatomical Knowledge-Guided Adversarial Generative Network,0,0,0,0,0,0,0,0,0,0,0,0,0,0,0,0,0,0,0,0,0,0,0,0,0,0,0,0,0,0,0,0,0
B-Cos Aligned Transformers Learn Human-Interpretable Features,0,0,0,0,0,0,0,0,0,0,0,0,0,0,0,0,0,0,0,0,0,0,0,0,0,0,0,0,0,0,0,0,0
BerDiff: Conditional Bernoulli Diffusion Model for Medical Image Segmentation,0,0,0,0,0,0,0,0,0,0,0,0,0,0,1,0,0,0,0,0,0,0,0,0,0,0,0,0,0,1,0,2,0
Beyond the Snapshot: Brain Tokenized Graph Transformer for Longitudinal Brain Functional Connectome Embedding,0,0,0,0,0,0,0,0,0,0,0,0,0,0,0,0,0,0,0,0,0,0,0,0,0,0,0,0,0,2,0,3,1
Bidirectional Mapping with Contrastive Learning on Multimodal Neuroimaging Data,0,0,0,0,0,0,0,0,0,0,0,0,0,0,0,0,0,0,0,0,0,0,0,0,0,1,0,0,0,0,0,0,0
BigFUSE: Global Context-Aware Image Fusion in Dual-View Light-Sheet Fluorescence Microscopy with Image Formation Prior,0,0,0,0,0,0,0,0,0,0,0,0,0,0,0,0,0,0,0,0,0,0,0,0,0,0,0,0,0,0,0,3,1
Black-box Domain Adaptative Cell Segmentation via Multi-source Distillation,14,0,0,0,0,0,0,0,0,0,0,0,0,0,0,0,3,0,0,0,0,0,0,1,0,0,0,0,0,36,28,44,34
Boosting Breast Ultrasound Video Classification by the Guidance of Keyframe Feature Centers,0,0,0,0,0,0,0,0,0,0,0,0,0,0,0,0,0,0,0,0,0,0,0,0,0,0,0,0,0,0,0,0,0
Boundary Difference over Union Loss for Medical Image Segmentation,0,0,0,0,0,0,0,0,0,0,0,0,0,0,0,0,0,0,0,0,0,0,0,1,0,0,0,0,0,0,0,0,0
Boundary-Weighted Logit Consistency Improves Calibration of Segmentation Networks,0,0,0,0,0,0,0,0,0,0,0,0,0,0,0,0,0,0,0,0,0,0,0,0,0,0,0,0,0,0,0,0,0
Brain Anatomy-Guided MRI Analysis for Assessing Clinical Progression of Cognitive Impairment with Structural MRI,4,0,0,0,0,0,0,0,0,0,0,0,0,0,0,0,0,0,0,0,0,0,0,0,0,0,0,0,0,0,0,2,0
BrainUSL: Unsupervised Graph Structure Learning for Functional Brain Network Analysis,0,0,0,0,0,0,0,0,0,0,0,0,0,0,1,0,0,0,0,0,0,0,0,0,0,0,0,0,0,0,0,0,0
Breast Ultrasound Tumor Classification Using a Hybrid Multitask CNN-Transformer Network,0,0,0,0,0,0,0,0,0,0,0,0,0,0,0,0,0,0,0,0,0,0,0,4,1,1,0,0,0,0,0,0,0
Bridging Ex-Vivo Training and Intra-operative Deployment for Surgical Margin Assessment with Evidential Graph Transformer,0,0,0,0,0,0,0,0,0,0,0,0,0,0,1,1,0,0,0,0,0,0,0,0,0,0,0,0,0,1,1,1,1
Building a Bridge: Close the Domain Gap in CT Metal Artifact Reduction,1,0,0,0,0,1,2,0,0,0,0,0,0,0,0,0,1,0,0,0,0,0,0,0,0,0,0,0,0,0,0,2,0
CARL: Cross-Aligned Representation Learning for Multi-view Lung Cancer Histology Classification,1,0,0,0,0,0,0,0,0,0,0,0,0,0,2,0,0,0,0,0,0,0,0,0,0,1,0,0,0,0,0,0,0
CAS-Net: Cross-View Aligned Segmentation by Graph Representation of Knees,1,0,0,1,0,0,0,0,0,0,0,0,0,0,1,1,0,0,0,0,0,0,0,0,0,1,0,0,0,1,1,2,1
CAT-ViL: Co-attention Gated Vision-Language Embedding for Visual Question Localized-Answering in Robotic Surgery,2,0,0,0,0,0,0,0,0,0,0,0,0,0,0,0,0,0,0,0,0,0,0,0,0,3,0,0,0,0,0,0,0
CDiffMR: Can We Replace the Gaussian Noise with K-Space Undersampling for Fast MRI?,2,1,0,0,0,0,0,0,0,0,0,0,0,0,0,0,2,0,0,0,0,0,0,0,0,1,0,0,0,0,0,0,0
CL-ADDA: Contrastive Learning with Amplitude-Driven Data Augmentation for fMRI-Based Individualized Predictions,0,0,0,0,0,0,0,0,0,0,0,0,0,0,0,0,0,0,0,0,0,0,0,3,0,0,0,0,0,0,0,0,0
CLIP-Lung: Textual Knowledge-Guided Lung Nodule Malignancy Prediction,0,0,0,0,0,0,0,0,0,0,0,0,0,0,0,0,0,0,0,0,0,0,0,0,0,1,0,0,0,0,0,0,0
COLosSAL: A Benchmark for Cold-Start Active Learning for 3D Medical Image Segmentation,3,1,0,0,0,1,2,0,0,0,0,0,0,0,1,0,1,0,0,0,0,0,0,0,0,0,0,0,0,3,2,8,6
COVID-19 Pneumonia Classification with Transformer from Incomplete Modalities,1,0,0,0,0,0,0,0,0,0,0,0,0,0,0,0,0,0,0,0,0,0,0,1,0,0,0,0,0,0,0,0,0
CT Kernel Conversion Using Multi-domain Image-to-Image Translation with Generator-Guided Contrastive Learning,0,0,0,0,0,0,0,0,0,0,0,0,0,0,0,0,0,0,0,0,0,0,0,0,0,1,0,0,0,0,0,0,0
"CT-Guided, Unsupervised Super-Resolution Reconstruction of Single 3D Magnetic Resonance Image",1,0,0,0,0,0,0,0,0,0,0,0,0,0,0,0,0,0,0,0,0,0,0,0,0,0,0,0,0,2,1,3,2
CTFlow: Mitigating Effects of Computed Tomography Acquisition and Reconstruction with Normalizing Flows,0,0,0,2,0,0,0,0,0,0,0,0,0,0,0,0,0,0,0,0,0,0,0,0,0,0,0,0,0,0,0,1,0
CXR-CLIP: Toward Large Scale Chest X-ray Language-Image Pre-training,0,0,0,0,0,0,0,0,0,0,0,0,0,0,0,0,0,0,0,0,0,0,0,0,0,0,0,0,0,2,1,2,1
Can Point Cloud Networks Learn Statistical Shape Models of Anatomies?,0,0,0,0,0,0,0,0,0,0,0,0,0,0,0,0,0,0,0,0,0,0,0,0,0,0,0,0,0,0,0,0,0
Cascade Transformer Encoded Boundary-Aware Multibranch Fusion Networks for Real-Time and Accurate Colonoscopic Lesion Segmentation,1,0,0,0,0,0,0,0,0,0,0,1,0,0,1,0,0,0,0,0,0,0,0,0,0,1,0,0,0,0,0,1,1
Category-Independent Visual Explanation for Medical Deep Network Understanding,1,0,0,0,0,0,0,0,0,0,0,0,0,0,0,0,1,0,1,0,0,0,0,0,0,0,0,0,0,0,0,0,0
Category-Level Regularized Unlabeled-to-Labeled Learning for Semi-supervised Prostate Segmentation with Multi-site Unlabeled Data,0,0,0,0,0,0,0,0,0,0,0,0,0,0,0,0,0,0,0,0,0,0,0,0,0,2,0,0,0,0,0,0,0
CellGAN: Conditional Cervical Cell Synthesis for Augmenting Cytopathological Image Classification,0,0,0,0,0,0,0,0,0,0,0,0,0,0,0,0,0,0,0,0,0,0,0,0,0,1,0,0,0,0,0,0,0
CenterlinePointNet++: A New Point Cloud Based Architecture for Coronary Artery Pressure Drop and vFFR Estimation,0,0,0,0,0,0,0,0,0,0,0,0,0,0,0,0,0,0,0,0,0,0,0,0,0,0,0,0,0,0,0,0,0
Centroid-Aware Feature Recalibration for Cancer Grading in Pathology Images,0,0,0,0,0,0,0,0,0,0,0,0,0,0,0,0,0,0,0,0,0,0,0,2,1,0,0,0,0,1,1,2,2
Certification of Deep Learning Models for Medical Image Segmentation,0,0,0,0,0,0,0,0,0,0,0,0,0,0,0,0,0,0,0,0,0,0,0,0,0,1,0,0,0,0,0,0,0
CheXstray: A Real-Time Multi-Modal Monitoring Workflow for Medical Imaging AI,0,0,0,0,0,0,0,0,0,0,0,0,0,0,0,0,0,0,0,0,0,0,0,0,0,1,0,0,0,3,2,5,3
Chest X-ray Image Classification: A Causal Perspective,0,0,0,0,0,0,0,0,0,0,0,0,0,0,0,0,0,0,0,0,0,0,0,0,0,0,0,0,0,0,0,0,0
CircleFormer: Circular Nuclei Detection in Whole Slide Images with Circle Queries and Attention,2,0,0,1,0,0,0,0,0,0,0,0,0,0,0,0,3,0,0,0,0,0,0,1,0,0,0,0,0,0,0,0,0
Class Specific Feature Disentanglement and Text Embeddings for Multi-label Generalized Zero Shot CXR Classification,1,0,0,0,0,0,0,0,0,0,0,0,0,0,0,0,0,0,0,0,0,0,0,0,0,1,0,0,0,0,0,0,0
Class-Aware Feature Alignment for Domain Adaptative Mitochondria Segmentation,0,0,0,0,0,0,0,0,0,0,0,0,0,0,2,0,0,0,0,0,0,0,0,0,0,0,0,0,0,0,0,0,0
Client-Level Differential Privacy via Adaptive Intermediary in Federated Medical Imaging,0,0,0,0,0,0,0,0,0,0,0,0,0,0,0,0,0,0,0,0,0,0,0,0,0,0,0,0,0,0,0,0,0
Clinical Evaluation of AI-Assisted Virtual Contrast Enhanced MRI in Primary Gross Tumor Volume Delineation for Radiotherapy of Nasopharyngeal Carcinoma,0,0,0,0,0,0,0,0,0,0,0,0,0,0,0,0,0,0,0,0,0,0,0,1,0,0,0,0,0,1,0,1,0
Cluster-Induced Mask Transformers for Effective Opportunistic Gastric Cancer Screening on Non-contrast CT Scans,2,0,0,0,0,0,0,0,0,0,0,0,0,0,0,0,0,0,0,0,0,0,0,0,0,1,0,0,0,4,0,4,0
Clustering Disease Trajectories in Contrastive Feature Space for Biomarker Proposal in Age-Related Macular Degeneration,1,0,0,0,0,0,0,0,0,0,0,0,0,0,0,0,0,0,0,0,0,0,0,2,0,0,0,0,0,0,0,0,0
Co-assistant Networks for Label Correction,0,0,0,0,0,0,0,0,0,0,0,0,0,0,0,0,0,0,0,0,0,0,0,0,0,0,0,0,0,0,0,1,0
Co-learning Semantic-Aware Unsupervised Segmentation for Pathological Image Registration,0,0,0,0,0,0,0,0,0,0,0,0,0,0,0,0,0,0,0,0,0,0,0,0,0,0,0,0,0,0,0,2,0
CoLa-Diff: Conditional Latent Diffusion Model for Multi-modal MRI Synthesis,0,0,0,2,0,0,0,0,0,0,0,0,0,0,0,0,0,0,0,0,0,0,0,0,0,0,0,0,0,2,1,3,2
CoactSeg: Learning from Heterogeneous Data for New Multiple Sclerosis Lesion Segmentation,0,0,0,0,0,0,0,0,0,0,0,0,0,0,0,0,0,0,0,0,0,0,0,0,0,0,0,0,0,0,0,0,0
Cochlear Implant Fold Detection in Intra-operative CT Using Weakly Supervised Multi-task Deep Learning,2,0,0,0,0,0,0,0,0,0,0,0,0,0,0,0,0,0,0,0,0,0,0,0,0,0,0,0,0,0,0,0,0
Collaborative Modality Generation and Tissue Segmentation for Early-Developing Macaque Brain MR Images,0,0,0,0,0,0,0,0,0,0,0,0,0,0,1,0,0,0,0,0,0,0,0,0,0,1,0,0,0,0,0,0,0
Combat Long-Tails in Medical Classification with Relation-Aware Consistency and Virtual Features Compensation,0,0,0,0,0,0,0,0,0,0,0,0,0,0,0,0,0,0,0,0,0,0,0,0,0,0,0,0,0,0,0,0,0
Combating Medical Label Noise via Robust Semi-supervised Contrastive Learning,8,0,0,0,0,0,0,0,0,0,0,0,0,0,0,0,0,0,0,0,0,0,0,22,6,1,0,1,0,0,0,0,0
Community-Aware Transformer for Autism Prediction in fMRI Connectome,1,0,0,0,0,0,0,0,0,0,0,0,0,0,0,0,1,1,0,0,0,0,0,0,0,1,0,0,0,0,0,1,0
Computationally Efficient 3D MRI Reconstruction with Adaptive MLP,0,0,0,0,0,0,0,0,0,0,0,0,0,0,0,0,0,0,0,0,0,0,0,0,0,0,0,0,0,0,0,0,0
ConTrack: Contextual Transformer for Device Tracking in X-Ray,1,0,0,1,0,0,0,0,0,0,0,0,0,0,0,0,0,0,0,0,0,0,0,0,0,0,0,0,0,0,0,0,0
Conditional Diffusion Models for Weakly Supervised Medical Image Segmentation,1,0,0,0,0,0,0,0,0,0,0,0,0,0,0,0,0,0,0,0,0,0,0,1,0,0,0,0,0,0,0,0,0
Conditional Physics-Informed Graph Neural Network for Fractional Flow Reserve Assessment,0,0,0,0,0,0,0,0,0,0,0,0,0,0,0,0,0,0,0,0,0,0,0,0,0,1,0,0,0,0,0,1,0
Conditional Temporal Attention Networks for Neonatal Cortical Surface Reconstruction,2,0,0,3,0,0,0,0,0,0,0,0,0,0,0,0,0,0,0,0,0,0,0,0,0,0,0,0,0,1,1,1,1
Consistency-Guided Meta-learning for Bootstrapping Semi-supervised Medical Image Segmentation,0,0,0,0,0,0,0,0,0,0,0,0,0,0,0,0,0,0,0,0,0,0,0,2,0,1,0,0,0,0,0,0,0
Content-Preserving Diffusion Model for Unsupervised AS-OCT Image Despeckling,1,0,0,0,0,0,0,0,0,0,0,0,0,0,5,0,0,0,0,0,0,0,0,0,0,1,0,1,0,0,0,2,2
Context-Aware Pseudo-label Refinement for Source-Free Domain Adaptive Fundus Image Segmentation,0,0,0,0,0,0,0,0,0,0,0,0,0,0,0,0,0,0,0,0,0,0,0,0,0,0,0,0,0,5,4,5,4
Continual Learning for Abdominal Multi-organ and Tumor Segmentation,1,0,0,0,0,0,0,0,0,0,0,0,0,0,0,0,0,0,0,0,0,0,0,0,0,1,0,0,0,0,0,0,0
Contrastive Diffusion Model with Auxiliary Guidance for Coarse-to-Fine PET Reconstruction,0,0,0,0,0,0,0,0,0,0,0,0,0,0,1,1,0,0,0,0,0,0,0,0,0,0,0,0,0,0,0,0,0
Contrastive Feature Decoupling for Weakly-Supervised Disease Detection,0,0,0,0,0,0,0,0,0,0,0,0,0,0,0,0,0,0,0,0,0,0,0,0,0,0,0,0,0,0,0,0,0
Contrastive Masked Image-Text Modeling for Medical Visual Representation Learning,0,0,0,0,0,0,0,0,0,0,0,0,0,0,0,0,0,0,0,0,0,0,0,0,0,0,0,0,0,0,0,0,0
ConvFormer: Plug-and-Play CNN-Style Transformers for Improving Medical Image Segmentation,0,0,0,0,0,0,0,0,0,0,0,0,0,0,0,0,0,0,0,0,0,0,0,0,0,0,0,0,0,0,0,3,0
Convolving Directed Graph Edges via Hodge Laplacian for Brain Network Analysis,0,0,0,0,0,0,0,0,0,0,0,0,0,0,0,0,0,0,0,0,0,0,0,0,0,0,0,0,0,0,0,0,0
CorSegRec: A Topology-Preserving Scheme for Extracting Fully-Connected Coronary Arteries from CT Angiography,0,0,0,0,0,0,0,0,0,0,0,0,0,0,0,0,0,0,0,0,0,0,0,1,0,0,0,0,0,0,0,0,0
Correlation-Aware Mutual Learning for Semi-supervised Medical Image Segmentation,0,0,0,0,0,0,0,0,0,0,0,0,0,0,0,0,0,0,0,0,0,0,0,0,0,0,0,0,0,0,0,0,0
CortexMorph: Fast Cortical Thickness Estimation via Diffeomorphic Registration Using VoxelMorph,2,0,0,0,0,0,0,0,0,0,0,0,0,0,0,0,0,0,0,0,0,0,0,0,0,0,0,0,0,0,0,0,0
Cortical Analysis of Heterogeneous Clinical Brain MRI Scans for Large-Scale Neuroimaging Studies,1,0,0,0,0,0,0,0,0,0,0,0,0,0,0,0,0,0,0,0,0,0,0,2,0,1,0,0,0,0,0,0,0
Coupling Bracket Segmentation and Tooth Surface Reconstruction on 3D Dental Models,0,0,0,0,0,0,0,0,0,0,0,0,0,0,0,0,0,0,0,0,0,0,0,0,0,1,0,0,0,0,0,0,0
Cross-Adversarial Local Distribution Regularization for Semi-supervised Medical Image Segmentation,1,0,0,1,0,0,0,0,0,0,0,0,0,0,0,0,0,0,0,0,0,0,0,0,0,0,0,0,0,1,0,1,0
Cross-Dataset Adaptation for Instrument Classification in Cataract Surgery Videos,4,0,0,0,0,0,0,0,0,0,0,0,0,0,1,0,8,0,0,0,0,0,0,1,0,0,0,0,0,0,0,0,0
Cross-Modulated Few-Shot Image Generation for Colorectal Tissue Classification,0,0,0,0,0,0,0,0,0,0,0,0,0,0,1,1,1,0,0,0,0,0,0,0,0,1,0,0,0,0,0,1,1
Cross-View Deformable Transformer for Non-displaced Hip Fracture Classification from Frontal-Lateral X-Ray Pair,0,0,0,0,0,0,0,0,0,0,0,0,0,0,0,0,0,0,0,0,0,0,0,0,0,0,0,0,0,0,0,1,0
CycleSTTN: A Learning-Based Temporal Model for Specular Augmentation in Endoscopy,2,0,0,0,0,0,0,0,0,0,0,0,0,0,0,0,0,0,0,0,0,0,0,0,0,0,0,0,0,0,0,0,0
DARC: Distribution-Aware Re-Coloring Model for Generalizable Nucleus Segmentation,4,0,0,0,0,0,0,0,0,0,0,0,0,0,0,0,0,0,0,0,0,0,0,0,0,1,0,0,0,0,0,0,0
DAS-MIL: Distilling Across Scales for MIL Classification of Histological WSIs,0,0,0,0,0,0,0,0,0,0,0,0,0,0,0,0,0,0,0,0,0,0,0,0,0,0,0,0,0,0,0,0,0
