,age,gender,sex,women,woman,female,male,geolocation,geographical,geographic,country,countries,city,cities,hospital,hospitals,clinic,clinics,society,societies,etnicity,etnicities,race,bias,biases,fair,unfair,fairness,transparency,imbalance,imbalanced,balance,balanced
DAST: Differentiable Architecture Search with Transformer for 3D Medical Image Segmentation,0,0,0,0,0,0,0,0,0,0,0,0,0,0,0,0,0,0,0,0,0,0,0,8,0,3,0,0,0,0,0,0,0
DBTrans: A Dual-Branch Vision Transformer for Multi-Modal Brain Tumor Segmentation,0,0,0,1,0,0,0,0,0,0,0,0,0,0,0,0,0,0,0,0,0,0,0,0,0,0,0,0,0,0,0,0,0
DCAug: Domain-Aware and Content-Consistent Cross-Cycle Framework for Tumor Augmentation,1,0,0,0,0,0,0,0,0,0,0,0,0,0,0,0,0,0,0,0,0,0,0,1,0,2,0,0,0,0,0,0,0
DHC: Dual-Debiased Heterogeneous Co-training Framework for Class-Imbalanced Semi-supervised Medical Image Segmentation,0,0,0,0,0,0,0,0,0,0,0,0,0,0,0,0,0,0,0,0,0,0,0,0,0,0,0,0,0,0,0,0,0
DISA: DIfferentiable Similarity Approximation for Universal Multimodal Registration,0,0,0,0,0,0,0,0,0,0,0,0,0,0,0,0,0,0,0,0,0,0,0,0,0,0,0,0,0,0,0,0,0
DMCVR: Morphology-Guided Diffusion Model for 3D Cardiac Volume Reconstruction,1,0,0,0,0,0,0,0,0,0,0,0,0,0,0,0,0,0,0,0,0,0,0,0,0,0,0,0,0,0,0,1,1
DOMINO++: Domain-Aware Loss Regularization for Deep Learning Generalizability,20,0,9,0,0,4,8,0,0,1,0,0,0,0,0,0,1,0,0,0,0,0,4,45,1,23,1,13,1,0,0,0,0
DRMC: A Generalist Model with Dynamic Routing for Multi-center PET Image Synthesis,0,0,0,0,0,0,0,0,0,0,0,0,0,0,0,0,0,0,0,0,0,0,0,2,0,0,0,0,0,0,0,5,0
DULDA: Dual-Domain Unsupervised Learned Descent Algorithm for PET Image Reconstruction,0,0,0,0,0,0,0,0,0,0,0,0,0,0,2,0,0,0,0,0,0,0,0,0,0,1,0,0,0,0,0,1,0
Data AUDIT: Identifying Attribute Utility- and Detectability-Induced Bias in Task Models,0,0,0,0,0,0,0,0,0,0,0,0,0,0,1,0,0,0,0,0,0,0,0,0,0,0,0,0,0,0,0,0,0
DeDA: Deep Directed Accumulator,0,0,0,0,0,0,0,0,0,0,0,0,0,0,0,0,0,0,0,0,0,0,0,0,0,0,0,0,0,0,0,0,0
Debiasing Medical Visual Question Answering via Counterfactual Training,0,0,0,0,0,0,0,0,0,0,0,0,0,0,0,0,1,0,0,0,0,0,0,0,0,0,0,0,0,1,0,4,0
Deblurring Masked Autoencoder Is Better Recipe for Ultrasound Image Recognition,1,0,0,0,0,0,0,0,0,0,0,0,0,0,0,0,0,0,0,0,0,0,0,1,0,0,0,0,0,0,0,0,0
Decoupled Consistency for Semi-supervised Medical Image Segmentation,0,0,0,0,0,0,0,0,0,0,0,0,0,0,0,0,0,0,0,0,0,0,0,0,0,0,0,0,0,0,0,0,0
Deep Cellular Embeddings: An Explainable Plug and Play Improvement for Feature Representation in Histopathology,0,0,0,0,0,0,0,0,0,0,0,0,0,0,3,1,0,0,0,0,0,0,0,1,0,1,0,1,0,1,0,1,0
Deep Homography Prediction for Endoscopic Camera Motion Imitation Learning,0,0,0,0,0,0,0,0,0,0,0,0,0,0,0,0,0,0,0,0,0,0,0,0,0,0,0,0,0,0,0,0,0
Deep Learning for Tumor-Associated Stroma Identification in Prostate Histopathology Slides,0,0,0,1,0,1,1,0,0,0,0,0,0,0,0,0,0,0,0,0,0,0,0,0,0,0,0,0,0,0,0,0,0
Deep Learning-Based Air Trapping Quantification Using Paired Inspiratory-Expiratory Ultra-low Dose CT,1,0,0,0,0,0,0,0,9,9,0,0,0,0,0,0,0,0,0,0,0,0,0,0,0,0,0,0,0,0,0,3,1
Deep Learning-Based Anonymization of Chest Radiographs: A Utility-Preserving Measure for Patient Privacy,0,0,0,0,0,0,0,0,0,0,0,0,0,0,0,0,0,0,0,0,0,0,0,0,0,0,0,0,0,0,0,0,0
Deep Mutual Distillation for Semi-supervised Medical Image Segmentation,3,0,0,0,0,0,0,0,0,0,0,0,0,0,1,0,1,0,0,0,0,0,0,0,0,0,0,0,0,0,0,0,0
Deep Probability Contour Framework for Tumour Segmentation and Dose Painting in PET Images,1,0,0,0,0,0,0,0,0,0,0,0,1,0,0,0,0,0,0,0,0,0,0,0,0,0,0,0,0,0,0,0,0
Deep Reinforcement Learning Based System for Intraoperative Hyperspectral Video Autofocusing,0,0,0,0,0,0,0,0,0,0,0,0,0,0,0,0,0,0,0,0,0,0,0,0,0,1,0,0,0,0,0,1,0
Deep Unsupervised Clustering for Conditional Identification of Subgroups Within a Digital Pathology Image Set,0,0,0,0,0,0,0,0,0,0,0,0,0,0,0,0,0,0,0,0,0,0,0,6,0,0,0,0,0,0,0,0,0
DeepGraphDMD: Interpretable Spatio-Temporal Decomposition of Non-linear Functional Brain Network Dynamics,1,0,0,0,0,0,0,0,0,0,0,0,0,0,0,0,1,0,0,0,0,0,0,0,0,0,0,0,0,0,0,3,3
DeepSOZ: A Robust Deep Model for Joint Temporal and Spatial Seizure Onset Localization from Multichannel EEG Data,0,0,0,0,0,0,0,0,0,0,0,0,0,0,0,0,0,0,0,0,0,0,0,0,0,0,0,0,0,0,0,1,0
Democratizing Pathological Image Segmentation with Lay Annotators via Molecular-Empowered Learning,0,0,0,0,0,0,0,0,0,0,0,0,0,0,0,0,0,0,0,0,0,0,0,0,0,1,0,1,0,0,0,0,0
Dense Transformer based Enhanced Coding Network for Unsupervised Metal Artifact Reduction,0,0,0,0,0,0,0,0,0,0,0,0,0,0,0,0,0,0,0,0,0,0,0,0,0,0,0,0,0,0,0,0,0
